word,sentence
حساب,تعداد حساب های بانکی افتتاح‌شده در سال جاری نسبت به سال گذشته افزایش چشمگیری داشته است.
حساب,مبلغ کل فاکتور خرید به دقت حساب شده و به مشتری اعلام شد.
حساب,در جلسه عمومی، حساب آرای شرکت‌کنندگان به دقت شمرده و اعلام گردید.
حساب,در مسابقات علمی، تعداد برندگان با حساب دقیق از میان شرکت‌کنندگان انتخاب شد.
حساب,حساب موجودی انبار پس از بررسی دقیق توسط کارشناسان تایید گردید.
حساب,برای افتتاح حساب بانکی نیاز به ارائه مدارک شناسایی معتبر است.
حساب,حساب پس‌انداز می‌تواند به شما کمک کند تا به اهداف مالی بلندمدت خود برسید.
حساب,اگر حساب بانکی خود را به‌موقع چک نکنید، ممکن است با هزینه‌های اضافی روبه‌رو شوید.
حساب,بانک‌ها برای حفاظت از حساب های مشتریان خود از سیستم‌های امنیتی پیشرفته استفاده می‌کنند.
حساب,پس از پایان پروژه، حساب نهایی تمامی هزینه‌ها و درآمدها باید تهیه و به مدیریت ارائه شود.
حساب,حساب و کتاب دقیق هزینه‌های جاری به بهبود وضعیت مالی سازمان کمک می‌کند.
حساب,در پایان هر ماه، حساب های مالی شرکت بررسی و صورت‌حساب‌های لازم تهیه می‌شود.
حساب,با استفاده از نرم‌افزارهای حسابداری، می‌توان به راحتی حساب های مالی را مدیریت و گزارش داد.
حساب,حساب نهایی پروژه باید به‌دقت تهیه و تمامی فاکتورها و هزینه‌ها در آن ذکر شود.
حساب,مدیریت مالی موفق نیازمند توانایی در بررسی و تحلیل حساب ها و تهیه گزارش‌های دقیق است.
حساب,حساب نهایی پروژه ساختمانی باید شامل تمامی هزینه‌های مواد، دستمزدها و سایر هزینه‌ها باشد.
حساب,حساب های مالی شرکت باید به‌صورت منظم و دقیق ثبت و بررسی شوند تا از صحت آن‌ها اطمینان حاصل شود.
حساب,استفاده از نرم‌افزارهای حسابداری به تهیه حساب های دقیق و شفاف کمک می‌کند.
