word,sentence
دورکردن,امروز که هیچ یک از این اهداف محقق نشده است، وزارت دفاع عربستان طی بیانیه ای، اهداف اعلام شده قبلی را فراموش کرده و دورکردن تهدید انصار الله ازعربستان و کشورهای حوزه خلیج فارس ، نابود کردن موشک ها ونیروی هوایی یمن را هدف اصلی عنوان می کند
اژانس,(4169979) (alef-11)   ۱۳۹۵-۱۲-۰۲ ۱۶:۰۶:۱۳ بهترين اعتراض اعمال نرخ منصفانه و رعايت قوانين و اعمال نرخ قانوني از طرف اژانس هاست نه محروم كردن مردم از يك سرويس قابل قبول و اشتغالزا (4170043) (alef-11)   ۱۳۹۵-۱۲-۰۲ ۱۶:۳۵:۲۵ آژانسهای تاکسی تلفنی سنتی باید به سرعت تغییر رویه بدهند چون دیگر کارایی ندارند و چه بخواهند چه نه این مدل شغل مانند خیلی از مشاغلی که قبلا وجود داشتند اما حالا نیستند ، از بین خواهند رفت
ابادان,به جناب خان بگویید نیاید می‌بافیمش! به جناب خان بگویید در بازی برابر سپاهان یا یکی از بازی‌های خانگی صنعت نفت آبادان منتظرش هستیم و اگر نیاید با بچه‌ها می‌آییم تهران و می‌بافیمش! کلمات کلیدی : حسن هوری+باشگاه صنعت نفت ابادان   نظراتی كه به تعميق و گسترش بحث كمك كنند، پس از مدت كوتاهی در معرض ملاحظه و قضاوت ديگر بينندگان قرار مي گيرد
ساییدن,عدم تعادلی که بر اثر ساییدن  دندان‌ها روی هم ایجاد می‌شود، می‌تواند باعث ایجاد درد ماهیچه‌ها و  دندان‌ها گردد
گستردن,کد خبر: ۷۲۳۴۹۲   تاریخ انتشار: ۱۳۹۶/۰۳/۲۰ ساکنان مومن و خداجو سنت حسنه گستردن سفره های افطاری
جداشدن,بابایی در گفت وگو با ایسنا با اشاره به جداشدن
جاافتاده,بیژن پدر همسر سابقش که فردی جاافتاده و دنیا دیده
پزو,عواملی همچون قطع  یارانه دولتی سوخت و کاهش 11 درصدی ارزش پزو در برابر دلار پس از انتخابات  ریاست جمهوری ماه نوامبر عامل این وضعیت بوده است
دمکرده,خواص شگفت انگیز گردواین متخصص تغذیه به دمکرده گیاه گردو
امدن,نرخ سود و پایین امدن بسیار زیاد سطح تورم از
خمار,این تجاوز توسط دو مرد در حالی صورت گرفت که شوهر این زن پس از استعمال مواد در اتاق کناری محل تجاوز خمار افتاده بود و توجهی به فریادهای همسرش نکرده بود
کشدار,با این حال مضمون این سریال  که گاه با انتقاد اجتماعی نیز همراه است، روی محور همان آدم‌ها و قصه‌های  سابق دور می‌زند که این بار با وصل کردن داستانک‌های تقریبا بی‌ربط،کشدار  شده است
سنگچین,هرچند می‌گویند  که کسی در تمام این سال‌ها برای دزدی یا مزاحمت نیامده اما هنوز هم برای  هربار بیرون آمدن از آن دالان سنگچین دلهره دارند: «تنها که نمیشه بریم قدم  بزنیم
ترسیدن,«آدم‌های این اطراف از ما  می‌ترسیدن
پزو,‌‌ ‌سال گذشته هر كيلو گوشت قرمز در بوينس آيرس، پايتخت آرژانتين 15 پزو فروخته مي شد درحالي‌كه قيمت آن هم ‌اكنون به 26 پزو رسيده است
فتوکپی,توصیه‌های درباره پاسپورت در سفرهای خارجی از  تمامی صفحات گذرنامه و ویزا دو سری فتوکپی تهیه کنید و یک سری را در منزل  گذاشته و یک سری را با خود حمل کنید تا در صورت سرقت یا مفقود شدن گذرنامه  از آن استفاده کنید
سیه,نخستین مهمان خارجی سفیر بریتانیا در واشنگتن بوده، که از وی می‌توان به‌عنوان گزینه قابل ‌پیش‌بینی یاد کرد ولی دیگری یک مهمان تقریبا سیه‌چرده و بی‌مو بود که در نگاه نخست بیننده را به یاد یول براینر، یکی از ستاره‌های سابق هالیوود می‌اندازد
گند,راه فرار از پیامک‌هایی که بوی گند می‌دهند بخش دانش و فناوری الف،9 بهمن95 بحث نظارت بر محتوای پیامک‌های انبوه از مدت‌ها پیش در مراجع مختلف دنبال شده، اما متاسفانه همچنان راه‌های فراری نیز برای این موضوع وجود دارد
خواباندن,مشخصات فنی حجم موتور: 2354 سی‌سی توان: 185 اسب‌بخار در 6400 دور در دقیقه گشتاور: 245 نیوتن‌متر در 3900 دور در دقیقه شتاب صفر تا صد: 8/2 ثانیه (در برخی از منابع عدد 8/5 ثانیه نیز ذکر شد) حداکثر سرعت: 193 کیلومتر بر ساعت (در برخی از منابع عدد 200 کیلومتر هم ذکر شد) مصرف سوخت ترکیبی: 8/5 الی 9 لیتر در هر صد کیلومتر سیستم تعلیق جلو: مک‌فرسون استرات، میل موج گیر سیستم تعلیق عقب: جناغی دوبل، میل موج گیر سیستم ترمز جلو: دیسکی خنک شونده سیستم ترمز عقب: دیسکی طول/عرض/ ارتفاع: 4550/1820/1685 میلی‌متر فاصله بین دو محور: 2620 میلی‌متر وزن: 1545 الی 1595 کیلوگرم گنجایش حجم بار: 556 (1120 لیتر، در صورت خواباندن صندلی‌ها) ظرفیت باک: 58 لیتر ایمنی این خودرو در موسسه بیمه ایمنی بزرگراه‌های آمریکا (IIHS) تحت تست‌های متعدد قرار گرفت و در تمامی بخش‌ها اعم از استحکام سقف، برخورد از نیمه جلو (همپوشانی کامل)، برخورد از بغل (بخش کناری) و نیز حفاظت از سر و صندلی‌ها و در نهایت هم در تست دشوار SMALL OVERLAP (همپوشانی کوتاه)، توانست بالاترین امتیاز و یا همان خوب (GOOD) را کسب کند
جاافتاده,"با  وجود رویکرد گاه "" تصادفی"" و حتی "" ناکام "" فرهنگستان زبان و ادبیات فارسی  در پیشنهاد واژگان نامانوس و غیر مصطلح به جای واژگان وارداتی مصطلح و  جاافتاده ، اما به عقیده  کارشناسان، کار و جایگاه این فرهنگستان بسیار مهم  است"
بلندکردن,ورزش‌ های هوازی شدید بلندکردن وزنه‌ های سنگین به بالای
بلندکردن,انجام دهد بلندکردن اجسام سنگین و ایستادن‌ های طولانی نباید
ترسیدن,کد خبر: ۴۶۱۷۰   تاریخ انتشار: ۱۳۹۲/۰۹/۳۰ جالبی از ترسیدن از سوسک در نمایش جدید خودرا بازگو
ترسیدن,در فیس بوک روایت جالبی از ترسیدن از سوسک در
افسونگر,سرآشپزی که لقب افسونگر آشپزخانه را یدک می‌کشد، سرآشپزی ماهر است که در نوجوانی به سراغ فوتبال رفت و در آن به سرعت پیشرفت کرد و در تیم جوانان گلاسکو رنجرز پذیرفته شد اما در نهایت با مصدومیت شدید دوران فوتبالی خود را آغاز نکرده به پایان رساند و کفش‌ها را آویخت
خز,به دلیل منحصر به فرد بودن خز این حیوان همیشه توسط شکارچیان کشته می شود
امدن,نرخ سود و پایین امدن بسیار زیاد سطح تورم از
ارام,به گفته محققان کلینیک مایو، انجام روزانه ۱۵ تا ۲۰ دقیقه نشستن ارام و نفس عمیق کشیدن می تواند به کاهش استرس کمک کند
ترسیدن,* در نیمه اول دیدیم که بچه‌ها بیش از توانشان می‌دوند و و پوشش‌هایی که به هم می‌دهند بیش از توان هوازیشان است و دقیقا همان جا بود که ما شروع به ترسیدن کردیم و جایی که خطاها شروع شد که تعدادش 8، 9 خطا در مقابل یک حریف بود، نشان می‌‌داد که بچه‌ها دارند از نظر بدنی کم می‌آورند
هییت,فرآیند انتخاب مدیر در ایران چطور است؟/ خاطره باهنر از انتخاب وزرا محمدرضا باهنر، عضو هییت رییسه مجلس شورای اسلامی مهمان برنامه «توقف ممنوع» با اجرای محمد دلاوری بود
بلندکردن,بلندکردن مصالح آسان می شود؛ با این نیم تنه کارگران ابرقهرمان می شوند بخش دانش و فناوری الف،3 مرداد96 یک شرکت آمریکایی نیم تنه ای برای کارگران ساخته که به آنان کمک می کند فعالیت هایی مانند بلندکردن مصالح را راحت تر انجام دهند
درخشیدن,پس منطقی‌اش این است که حسرت هر پیج پرفالوئری را نخورید و اگر انگیزه‌تان برای کسب لایک بیشتر و درخشیدن در فضای مجازی، آنقدرها هم قوی نیست، خودتان را در قالب یک گدای لایک جا نزنید و اجازه دهید افراد، آزادانه و با میل و رغبت شما را لایک کنند
ترسیدن,رئیس دولت تدبیر و امید با بیان اینکه برخی موسسات خصوصی و برخی بانک ها هنوز از ورود معامله با ایران هراس دارند که مصداق همان ترسیدن مارگزیده از ریسمان سیاه و سفید است، تصریح کرد: بانک هایی که قبلا به خاطر کار با ایران جریمه شده اند الان از کارکردن با ایران می ترسند که در این زمینه آمریکا باید فعالتر باشد و باید به همه آن‌ها با تاکید اعلام کنند که در رابطه با ایران آزاد هستند
مسیول,فدریکا موگرینی مسیول سیاست خارجی اتحادیه اروپا در این نشست خبری که در محل کمیسیون اروپا برگزار شد با بیان این که همانگونه که می دانید آمادگی ها برای دیدار از ایران در حال انجام است گفت: این دیدار در بهار انجام خواهد شد
پرکننده,درنهایت نگین با استفاده از چسبي مخصوص و با مواد پرکننده همرنگ دندان به دندان‌تان چسبیده می‌شود
شتری,مثل آن عکسی که زن محجبه همزمان با شوهرش هندوانه شتری گاز می زند و بالایش هم نوشته «جهان زن همسرداری است» که در تمام این موارد، مگر آموزش با این استیکر و عکس شدنی است و مفهوم انتقال پیدا می کند؟ این عکس ها و استیکرها به هر دلیلی که ساخته می شود، در شأن زنان محجبه ما نیست
صادرکردن,رییس‌ جمهوری با اشاره به اینکه برجام به معنای احقاق حقوق ملت ایران بود، گفت: برجام برای صادرکردن آب سنگین اراک، صادر کردن UF6 نطنز به کشورهای صنعتی جهان و برای آن بود که در دنیای امروز بتوانیم به راحتی نفت، گاز، پتروشیمی و میعانات گازی را به جهان صادر کنیم
پیچاندن,در‌این‌باره گفته می‌شود شهردار و شورای شهر لاهیجان باز هم اقامه دعوا علیه مالکان سرقفلی این ملک کرده‌اند و موضوع در مراجع قضائی در حال پیگیری چندین و چندباره است؛ درحالی‌که مخاطبشان همچنان به دنبال پیچاندن موضوع و بالاتربردن نرخ واگذاری است
کشدار,بوی  قارچ و ذرت پخته که به محض ترکیب شدن با کره و پنیر کشدار پیتزا، شما را  مجاب می‌کند دست در جیب مبارک کنید و یک لیوان ذرت مکزیکی خریداری کنید
جداکردن,html?494404  --------------------------------------------------  عنوان : گوشی عجیب و غریب فیس بوک  بخش دانش و فناوری الف،31 تیر96  --------------------------------------------------  شرکت فیس بوک به دنبال تولید گوشی جدید و عجیبی است که تمامی اجزای آن قابل جداکردن و تعویض و به روزرسانی است
جداکردن,گوشی عجیب و غریب فیس بوک بخش دانش و فناوری الف،31 تیر96 31 تير 1396 ساعت 15:39 شرکت فیس بوک به دنبال تولید گوشی جدید و عجیبی است که تمامی اجزای آن قابل جداکردن و تعویض و به روزرسانی است
جداکردن,گوید روش تحقیقی ما اسکن کردن لباس جداکردن لباس از
گماشتن,در حقیقت نمایندگان مجلس در آغاز با اصل کابینه و از جمله فرجی دانا با  اغماض و حسن ظن مواجه شدند حال آن که برخی اسناد عدم صلاحیت وجود داشت اما  به تدریج با بروز رفتارهای قانون شکنانه و افراطی در زمینه عزل و نصب ها،  گماشتن افراطیون و عناصر مسئله دار بر مصادر امور با وجود استعلام های منفی  معلوم شد، امثال فرجی دانا از خود استقلال رأیی ندارند و صرفاً به عنوان  ماشین امضای دیگران عمل می کنند و قدرت وفاداری به خطوط قرمز نظام را  ندارند
حنبلی,چرا آمریکایی‌ها پس از 15 سال تازه مقرهای فرماندهان طالبان را  پیدا کرده‌اند؟ اهداف پشت پرده آمریکا از تضعیف طالبان چیست؟ اساساً چه  تفاوتی بین طالبان و داعش وجود دارد که آمریکایی‌ها داعش را به طالبان  ترجیح می‌دهند؟   تفاوت تفکر تکفیری با تفکر ماتریدیه با وجود آنکه اهل سنت از نظر فقهی به چهار گروه: شافعی، حنفی،  حنبلی و مالکی تقسیم می‌شوند؛ اما از نظر اعتقادی نیز در چهار گروه  ماتریدیه، اشاعره، اصحاب حدیث و سلفی قرار می‌گیرند
حنبلی,همین سبب شد تا  تفکر سلفی گری حدود 500 سال به محاق برود تا اینکه در قرن 12 هجری شخصی به  نام محمد بن عبد الوهاب که از افراد بزرگ حنبلی در شبه جزیره حجاز محسوب  می‌شد، مجذوب تفکرات ابن تیمیه می‌گردد و دوباره دست به تبلیغ تفکر  سلفی‌گری می‌زند
حنبلی,در همان زمان وی با مخالفت شدید برادر و پدرش که آن‌ها  نیز از بزرگان حنبلی بودند، مواجه می‌شود
پرکننده,برچسب ها عنوان پرکننده در صنعت لاستیک مصرف می شود دوده در
سیرکردن,سازمان ملل: 7 میلیون یمنی در معرض گرسنگی‌اند هماهنگ کننده امور بشردوستانه سازمان ملل در یمن هشدار داد، درحالی که ۱۷  میلیون یمنی توان سیرکردن شکم خود را ندارند، هفت میلیون تن در این کشور در  معرض خطر گرسنگی هستند
خواباندن,انگار که براي خواباندن عروسکش به زبان کردي لالايي بخواند
اهنگ,مسن‌ترین و جوان‌ترین داوطلب وی با اشاره به مسن‌ترین و جوان‌ترین داوطلب ثبت نام کننده در آزمون سراسری 94 گفت: مسن‌ترین داوطلب ثبت نام کننده ابوتراب صالحی متولد 1314 از استان همدان، شهرستان کبودر اهنگ و جوان‌ترین داوطلب کنکور امسال، عطیه امیریان متولد سال 1379 در گروه آزمایشی زبان‌های خارجی از استان خراسان رضوی و شهرستان مشهد است
تاباندن,با شکایت اصولگرایان احضار و با قرار آزاد شد خرداد: مبارزه با فساد و تاباندن نور در یکی از تاریک‎خانه‎های شهرداری تهران برای عضو اصلاح‎طلب شورای شهر تهران دردسر ساز شد و  در پی شکایت اصولگرایان شورای شهر در ارتباط با املاک نجومی به دادسرا احضار و با تعیین قرار از سوی بازپرس آزاد شد
گند,معلوم شد علامت (×) كذايي نه روي عكس، بلكه پشت عكس در پايان پاراگرافي كه مترجم تا آنجا ترجمه كرده بود قرارگرفته و چون كاغذ مجله «لايف» نازك بود، انعكاس (×) در روي عكس درست بالاي سر كسي قرار گرفته كه آنها فكر مي‌كردند شاه است – شايد هم بود! – مدير، آنها را شيرفهم كرد كه اين مطلب مجله لايف در دو نوبت ترجمه شده و مترجم آن براي اين كه بداند تا كجاي آن را ترجمه كرده و براي مجله فرستاده و از كجاي آن بايد ترجمه كند، آن (×) را در پايان آن پاراگراف گذاشته كه به خاطر نازكي كاغذ، در پشت صفحه، نقش بسته كه قانع نشدند و با دستگيري مترجم و تأييد نظر ما از طرف او ـ و اين كه اگر قضيه را كشدار كنند، گندِ بيشتري زده‌اند ـ بي سر و صدا قال قضيه را خواباندند ـ چون اين را مي‌دانستند كه اگر قضيه را دنبال مي‌كردند انعكاس آن بين مردم بيشتر مي‌شد و رسوايي ـ اين شباهت ناگزير ـ يا واقعيت پنهاني بيشتر آشكار مي‌گرديد
واداشتن,واداشتن فرد مبتلا به زوال عقل به انتخاب یک فعالیت مشخص کمک می‌کند که او به‌عنوان یک عضو فعال در جامعه حضور پیدا کرده و درنتیجه، احساس مفید بودن کند
ابادان,در ادامه انسیه شاه حسینی کارگردان و سردار پورجمشید به ذکر دیگر خاطرات از کارهای فرهنگی و جهادی این شهید پرداختند و سپس تندیس شهید دریاقلی سورانی که هرساله در 9 ابان سالگرد حماسه ذوالفقاری از سوی مردم ابادان به افراد برجسته که کار مهمی در راستای ابادانی و دفاع از مملکت کرده باشند اهدا می‌شود توسط نوروزی فرمانده اسبق سپاه آبادان و به نمایندگی از مردم این شهر به خانواده شهید اهدا شد
اهنگ,"شاه ماهی حل پرونده کرسنت,,ثبت نام مرحله دوم يارانه,جام جهاني فوتبال,جام جهاني برزيل,دانلود,آهنگ,عکس,دانلود آهنگ,بازي,فيلم,چت,اندرويد,دانلود اهنگ,google,عکس,دختر,زن,لباس,تصوير,ايران,فيلم,عروس, girl,hot,World Cup, World Cup,World Cup in Brazil, Malaysian Airlines, اشتراک گذاری برچسب ها"
اوردن,"نشنال اینترست در این باره می نویسد:""او به طور آشکار درباره نفرت خود از آنچه برادر ناتنی ملک سلمان برای به چنگ اوردن قدرت در خاندان انجام می دهد صحبت می کند"
جاافتاده,کد خبر: ۱۳۸۲۹۴   تاریخ انتشار: ۱۳۹۶/۰۵/۰۱ تعیین قیمت خودرو جاافتاده است گفت تعیین این فرمول با
جداکردن,تأسیس دانشگاه‌های دخترانه و همچنین جداکردن کلاس‌های دختران و پسران در دانشگاه‌های آزاد واحد شهرستان‌ها که چندین سال است انجام می‌شود تأییدی بر این ماجراست
ایین,برخی از ایرانیان با توجه به آن که خود را از نژاد اریایی و وارثان ایین زرتشتی دین اکثریت در ایران قبل از ورود اسلام می دانند اهل سنت و دین آنان را وارداتی و منبع دور شدن آنان از ریشه های خود می بینند
افسونگر,کد خبر: ۶۹۹۸۷۸   تاریخ انتشار: ۱۳۹۵/۱۰/۱۳ قرار می گیرد فیلم سینمایی افسونگر با سرگروه ماندانا اکران
دریده,حتی در مواردی دیده شده که این شوخی‌ها پرده‌های حیا را دریده و برخی افراد را نسبت به هم گستاخ‌تر کرده است
تمثیل,پیکره کامل از ایجاز، استعاره، نماد، تمثیل همه از ادبیات وارد سینما شده و دو سویه است
جداشدن,راه حل‌های دیگر جداشدن به این مفهوم را ندارد
خمار,«خمر من و خمار من/ باغ من و بهار من/خواب من و قرارمن/ بي‌تو به سر نمي‌شود»
امدن,زیباترین زن جهان کیست؟ + تصاویر شبکه مردمی اطلاع رسانی(شمانیوز):مجسمه و اجرای اورلان به نام «بوسه ی هنرمند» باعث شهرت او در جامعه ی هنری شد و موجب بوجود امدن واکنش های مثبت و منفی شد
امدن,مجسمه و اجرای او به نام «بوسه ی هنرمند» باعث شهرت او در جامعه ی هنری شد و موجب بوجود امدن واکنش های مثبت و منفی شد
پرکننده,این پرکننده ها انواع مختلفی دارند که می توانند خالی شدگی‌های زیر پوست را جبران کنند
پرکننده,در حال حاضر از مواد پرکننده دائمی به دلیل عوارض و واکنش هایی که ایجاد می شود، مورد استفاده قرار نمی گیرند
پرکننده,چربی هم نوعی فیلر است و قبل از تولید اسید هیالورونیک پرکننده چربی بسیار شایع بود اما در حال حاضر به دلیل ایجاد تورم طولانی مدت پس از تزریق چربی و مشخص نبودن زمان جذب و میزان ماندگاری آن در حال حاضر اسید هیالورونیک نسبت به سایر فیلرهای دیگه ارجحیت دارد
پرکننده,این متخصص پوست عنوان کرد: تزریق بوتاکس و پرکننده ها در آرایشگاه ها یا توسط اشخاصی که مهارت لازم را در این خصوص ندارند موجب ایجاد عوارض زیادی در افراد شده است
پرکننده,وی بیان کرد: روزانه تعداد زیادی متقاضی مراجعه کننده به کلینیک های تخصصی پوست برای تزریق این پرکننده ها مراجعه می کنند اما چون شرایط آن را ندارند انجام نمیشود
سیه,به گزارش صبحانه ، به نقل از یورو نیوز، قدیمی‌ترین بانک دنیا موسوم به «مونته دی پاسکی دی سیه نا» 500 شعبه خود را تا سال 2019 تعطیل خواهد کرد
ایین,صادرات در ایین بخش ثبت شد که واحد های فولاد
گند,منزل مسکونی این پسر بچه آمریکایی که چهار برادر دیگر نیز دارد پر از آشغال، گند و کثافت، بطری های الکل و سوسک بود
