word,sentence
فراگرفتن,کاسب دیگری بود که به سمنان آمد و تشخیص داد که یک روحانی که بتواند مجالس را اداره کند در سمنان وجود ندارد و برای همین نیت کرد که 2 نفر را برای فراگرفتن دروس طلبگی به قم بفرستد
اوردن,با نصب و اعمال این برنامه عالی برروی دیوایس اندرویدی خودتان می توانید اینترفیس آن را به کلی دگرگون سازید و علاوه بر به ارمغان اوردن یک محیط کاربری شیک و دلربا، ویژگی هایی عالی همچون ارسال سریع به پیامک ها را داشته باشید
اوردن,با نصب و اعمال این برنامه عالی برروی دیوایس اندرویدی خودتان می توانید اینترفیس آن را به کلی دگرگون سازید و علاوه بر به ارمغان اوردن یک محیط کاربری شیک و دلربا، ویژگی هایی عالی همچون ارسال سریع به پیامک ها را داشته باشید
گستردن,ريخت و پاش‌های آن چنانی و گستردن سفره‌های چرب و شيرين از پول بيت المال به بهانه برخورداری از ثواب افطار، نه تنها اسراف بلکه هزینه مازادی است که لازم بوده مسئولین این مهم را در نظر بگیرند
جداشدن,۶ دلیل برای استفاده از اینترنت اکسپلورر     IE روحیه همکاری را تقویت میکند     افزایش توانایی های کامپیوتری شما      باعث افزایش تمرکز می شود     به زندگی بدون گوگل عادت می کنید      با بقیه فرق خواهید داشت      باعث میشود که جای پیشرفت داشته باشید مزایا: داشتن قابلیت بستن پنجره های تبلیغاتی( pop-up blocker )  بالابردن ضریب امنیتی مرورگر در سرویس پک 2  پشتیبانی از قابلیت ActiveX فایرفاکس بررسی مزایا و کعایب محبوب ترین مرورگر ها پس از جداشدن شرکت Mozilla این شرکت مبنای کاری خود را در جهت تولید مرورگری که هم رایگان باشد و نیز Open Source قرار داد
تمثیل,موزونی ساخت تمثیل سازی جاذبه های سینمای تجاریِ روز تحلیلِ
بلندشدن,آیا مصباح نتیجه هشت سال عملکرد دولتی که مدعی بود «پول یارانه‌ها پول امام‌زمان است و يقيناً امام‌عصر(عج) اجراي موفق طرح را هدايت مي‌كنند» و از «هالهٔ نور» سخن می‌گفت و مدعی «ارتباط با آخرالزمان و غیب» بود و مسائل مدیریتی کشور را به امور مقدس ربط می‌داد، را ندیده که چنین از اظهارات منطقی و دلسوزانه رئیس‌جمهور خشمگین می‌شود و به تندی سخن می‌گوید؟ حاصل دین دولتی را مردم به‌خوبی در دوره احمدی‌‌نژاد مشاهده کردند اما پرسش در اینجاست که؛ آیا آیت‌الله هنوز عواقب و هزینه کشاندن مقدسات و امام عصر(عج) به پای دولت احمدی‌نژاد برای اسلام، روحانیت و نظام را متوجه نشده است؟    انتقادات مبنایی نسبت به دولت  انتقاد پدر معنوی محمود احمدی‌نژاد از دولت حسن روحانی تازگی ندارد، چه‌آنکه وقتی سید عباس عراقچی، معاون وزیر خارجه و عضو ارشد تیم مذاکره کننده هسته‌ای با آیت‌الله ملاقات کرده بود؛ وی بدون آنکه به بلندشدن دیوار بی‌اعتمادی بین مردم و دولت، ایجاد شکاف و نابرابری‌های اجتماعی و خدشه‌دارشدن عزت ملی و کرامت شهروندان در دوران احمدی‌نژاد اشاره‌ای داشته باشد، با ابراز نگرانی از «پدیدآمدن سوءظن و کم‌اعتمادی نسبت به دولت جدید»؛ گفته بود «ما انتقادات مبنایی نسبت به دولت داریم که مربوط به موضوع مذاکرات هسته‌ای نیست
دورکردن,وی اضافه می کند: در قشر مرفه یکی از موضوعاتی که  در چند روز اخیر مطرح شده همین دور دورکردن ها با ماشین های لوکس است، اما  باید پرسید چه فرصت هایی را برای ابراز وجود ایجاد کرده ایم؟ البته این  موضوع ، مساله ای نیست که از آن غافل شویم
تمثیل,مهرجویی هم در «اجاره‌نشین‌ها» در بستری از طنز و با لحنی که خالی از تمثیل نبود، چنین کاری را صورت داد
اوردن,18 – بازی موتورسواری مبتنی بر فیزیک اندروید + مود Fail Hard یکی از زیباترین، هیجان برانگیزترین و لذت بخش ترین بازی های موتورسواری مبتی بر قوانین فیزیک برای سیستم عامل اندروید می باشد که در آن شما باید با استفاده از قوانین فیزیک به گونه ای موتور را هدایت کنید که علاوه بر به دست اوردن سکه های موجود در مسیر، موانع را بدون به زمین خوردن پشت سر بگذارید! تنها کاری که شما می کنید این است که با دقت تمام بدلکاری های مختلفی را انجام دهید و به جمع اوری سکه های موجود در مسیر حرکت بپردازید و با کمک آن ها تجهیزات خود را ارتقا دهید و موتورهای جدید با قدرت بالاتر را بخرید تا در نهایت هیجان را دو چندان کنید! هدف شما رسیدن به صدر بدلکار موتورسواری جهان می باشد ؛ پس باید با تمام سعی و تلاش برای رسیدن به این رتبه یعنی بهترین بدلکار جهان به کار بگیرید
اوردن,18 – بازی موتورسواری مبتنی بر فیزیک اندروید + مود Fail Hard یکی از زیباترین، هیجان برانگیزترین و لذت بخش ترین بازی های موتورسواری مبتی بر قوانین فیزیک برای سیستم عامل اندروید می باشد که در آن شما باید با استفاده از قوانین فیزیک به گونه ای موتور را هدایت کنید که علاوه بر به دست اوردن سکه های موجود در مسیر، موانع را بدون به زمین خوردن پشت سر بگذارید! تنها کاری که شما می کنید این است که با دقت تمام بدلکاری های مختلفی را انجام دهید و به جمع اوری سکه های موجود در مسیر حرکت بپردازید و با کمک آن ها تجهیزات خود را ارتقا دهید و موتورهای جدید با قدرت بالاتر را بخرید تا در نهایت هیجان را دو چندان کنید! هدف شما رسیدن به صدر بدلکار موتورسواری جهان می باشد ؛ پس باید با تمام سعی و تلاش برای رسیدن به این رتبه یعنی بهترین بدلکار جهان به کار بگیرید
تاباندن,درمان این موارد عبارت است از حذف کریپت ها با تاباندن اشعه لیزر و یا برداشتن کل لوزه به روش جراحی است
یکسر,وی ادامه داد: همچنین سقف و کف سوخت یارانه‌ای براساس فاکتورهایی چون شرایط جوی مسیرها، یکسر بار خالی برگشت و شیب جاده محاسبه خواهد شد
یکسر,در حال حاضر 33 درصد کل ترددها به‌صورت یکسر بار خالی است که باید این موارد هم در نظر گرفته شود‌
پزو,عواملی همچون قطع یارانه دولتی سوخت و کاهش ۱۱ درصدی ارزش پزو در برابر دلار پس از انتخابات ریاست جمهوری ماه نوامبر عامل این وضعیت بوده است
سیه,رو سیه تاکنون چند محکومیت در مورد بمباران های حلب گرفته است که مهم ترین آن محکومیت سازمان ملل در مورد جنایات جنگی در این شهر و نیز محکومیت از شورای عمومی خقوق بشر این سازمان است
ایین,به تخلفات لایحه تعیین عناوین تخلف و ایین رسیدگی به
اژانس,کد خبر: ۲۲۷۶۳۱   تاریخ انتشار: ۱۳۹۶/۰۵/۰۱ اورانیوم و پلوتونیوم تهران متوقف می شد بازرسان اژانس انرژی
نگاشتن,سعید قوام پور با بیان اینکه برنامه ششم صنعت نفت بر اساس واقعیتهای موجود و با توجه به شرایط کشور نوشته می شود و همانند برنامه پنجم آرمانی نیست، گفت: برنامه گذشته سبب شد تا ما برای نگاشتن برنامه جدید ارزیابی مان را دست بالا نگیریم و برنامه را براساس واقعیت بنویسیم هر چند یک گزینه خوشبینانه هم تدوین خواهد شد
فراگرفتن,از دیرباز خواندن و آموختن به وجود انسان آمیخته شده و برای دانستن و فراگرفتن و دانشمندشدن به ابزارهایی نیاز است که هنوز مفیدتر از کتاب یافت نشده است
کشدار,نفسی از جنس بازدم،که نفس گیر است و کشدار
اهنگ,"کد خبر: ۲۳۳۵۲۷   تاریخ انتشار: ۱۳۹۵/۰۸/۰۷ تداوم واكنش ها به اعلام عدم كانديداتوري احمدي نژاد؛ با اذعان به ""پایان احمدی نژاد"" اهنگ عاشقانه ""خداحافظ"" احسان"
جداشدن,از سوی دیگر،تماشاگر مطلع با فقدان موضوعاتی چون؛عدم پرداخت ریشه یابی نام کشور عراق،ریشه لغوی بغداد،خرابه های تیسفون و طاق کسری (خسرو)،تحولات عثمانی و نحوه جداشدن عراق از عثمانی و ترکیه امروز،عدم توجه معنادار  به حضور بنیانگزار انقلاب در عراق،چرایی جنگ ۱۶ کشور در کنار عراق علیه ایران،چرایی حمله موشکی صدام به اسراییل پیش از اتمام حمله امریکا و اشغال بغداد و دلیل برزبان آوردن جملات ؛مرگ بر اسراییل ،مرگ بر ایرانی آتش پرست و زنده باد فلسطین توسط صدام حسین،نمی تواند به استنادهای این مستند پر زرق و برق،دلخوش کند
جاافتاده,به نظرم لوگویی را که جاافتاده نباید عوض کرد
فراش,معنی کلمه Lackey (yeuqcal) پادو، نوکر، فراش‌، چاکری‌ کردن‌، نوکری‌ کردن‌ آخرین اخبار
طفیلی,"کد خبر: ۱۷۰۳۹   تاریخ انتشار: ۱۳۹۵/۰۱/۱۳ پاسخ بانوی منتخب قزوین در مجلس به قاضی پور: به عنوان عضو جامعه زنان شریف ایران تذکر می دهم افکارتان را در مورد ""زن"" به عنوان موجودی محجور و طفیلی، عوض کنید حمیده زرآبادی که به عنوان اولین منتخب قزوین به مجلس"
طفیلی,اما حل این مشکل با سخنرانی، نطق کردن، پول به مردم دادن، طفیلی گری  جور در نمی آید
اهنگ,تری تک اهنگ های «زندان» و «گلدون»،نسخه ویو آنها را هم منتشر کردتا مخاطب علاقه مند بتواند با کیفیت مطلوب تر ترانه خواننده محبوبش را بشنود
پزو,تأثیر مثبت مناظرۀ کلینتون و ترامپ بر پول مکزیکی‌ها! سه شنبه 6 مهر 1395 - 19:38 ارزش پول ملی مکزیک (پزو) که طی روزهای گذشته به پایین‌ترین سطح خود در برابر دلار رسیده بود، به میزان دو 2 درصد افزایش یافت
پزو,پزو با افزایش حدود یک و چهاردهم درصد در روز با نرخ 19
فراش,کرمی به مردانی که قصد تجدید فراش دارند پیشنهاد کرد: به عواقب این عمل بیشتر فکر کرده و اگر امکان اصلاح رفتار از سوی همسر یا تغییر وجود دارد، موضوع را به همسرشان اطلاع دهند
سیه,کد خبر: ۷۱۳۶۰۸   تاریخ انتشار: ۱۳۹۶/۰۱/۱۴ این سیه‌چهره خوش خبر کیست! لقب ظاهرا عربی حاجی یا بشارت دادن نوروز ایرانی در
افسونگر,آثار استاد امین الله رشیدی پس از انقلاب اسلامی از سال ۱۳۷۸ بار دیگر در ایران منتشر شد و بصورت سی‌دی و کاست به بازار عرضه گردید که از جمله آنان می توان به آلبوم های :دلم تنگ است،افسونگر،من عشقم ، عطر گیسو،چشم شب ، بخت گمشده ، زمستان و
درخشیدن,"با لطف خداوند متعال و تلاشهای شایسته تحسین همکاران ارجمندم درستاد معاونت و دفاتر, معاونین عزیزو گرانمایه آموزش ابتدایی, روسای بزرگوار ادارات سه گانه وکارشناسان فکور ادارات کل استانها, ادارات شهرستانها و مناطق, مدیران فداکار و آموزگاران شریف مدارس شاهد بودیم که در این مدت کوتاه,علیرغم بعضی محدودیت‌ها و موانع با تدبیر شما نیکان بارقه های زیبای امید در آسمان تعلیم وتربیت نوآموزان و دانش آموزان عزیزمان درخشیدن گرفته است"
فتوکپی,در این صورت چند مغازه در منطقه شما وجود دارد که همچنان کتاب کالای فرهنگی و محوری فروش بوده و چند کتابفروشی هم پس از مدتی تغییر شغل داده یا آرام آرام قفسه‌های کتاب را به حداقل رسانده و جای آن را لوازم‌التحریر و اسباب‌بازی و فتوکپی گرفته است؟ حتی در میدان انقلاب با حجم قابل توجهی از کتابفروشی‌ها باز به نظر می‌رسد حال چندان مساعدی ندارد
تمثیل,البته این اصطلاح تمثیل حداقلی از روابط میان زن و مرد و نقش مرد در زندگی زن است و در شرایط معمول یا مطلوب تصویری بسیار بزرگتر و ستایشاتی بسیار بیمار گونه‌تر از این رابطه دوسویه موجود است
یکسر,عامری با بیان اینکه نرخ بلیت‌ در این ایام برای جبران تردد یکسر خالی دو برابر می‌شود، گفت: در ابتدای هفته همه اتوبوس‌ها با صندلی تکمیل به پایانه‌های مرزی می‌روند و خالی برمی‌گردند و از سوی دیگر هنگام بازگشت زائران همه اتوبوس‌ها با صندلی تکمیل برمی‌گردند و دوباره با صندلی خالی به پایانه‌های مرزی می‌روند، بنابراین باید این تردد یک سر خالی به نحوی جبران شود
خواباندن,راهکار‌هایی برای خواباندن نوزاد در صورتی که بچه کم‌خواب یا بدخواب شد،‌ پدر و مادر باید او را آرام کرده و سعی نکنند به زور دوباره او را بخوابانند
ضربی,"com/Feed""></script> خبرهای سازهای ضربی همایون نصیری: «دارکوب» هیچوقت تکراری و روتین نبود   موسیقی ایرانیان   ۱۳۹۶/۳/۵ ارکوب را به همراه دوستانش تاسیس کرد و با تاکید بر سازهای ضربی، توانست عده زیادی از مردم را به سوی خود جلب کند"
ردشدن,آخرین‌بار که ردشدن یک توپ از خط دروازه خیلی خبرساز شد، بازی آلمان و انگلیس در جام‌جهانی ۲۰۱۰بود که توپ «فرانک لمپارد» از خط دروازه‌ی «مانوئل نویر» عبور کرد، اما داور و کمک‌داور متوجه نشدند و در نهایت آلمان با نتیجه‌ی چهار بر یک پیروز شد تا سروصدای زیادی برپا شود
فراگرفتن,وی افزود: از سویی دیگر، هر کدام از سلامت‌یاران که قرار است به شکل داوطلبانه انجام وظیفه کنند، به شدت در معرض ابتلا به بیماری‌های واگیر هستند، به همین خاطر تاکید ما این است که  هلال احمر اطمینان لازم در خصوص فراگرفتن آموزش‌های لازم را در این زمینه ایجاد کند
جاافتاده,کما اینکه دستفروشی همواره قسمتی از اقتصاد و فرهنگ مردم را  شکل می‌داده است و در چهرهٔ فضاهای شهری ما امری جاافتاده، دیرپا، آشنا و  پذیرفته شده‌است
اراسته,است که توسط انتشارات میراث اهل قلم، به زیور طبع اراسته شده است
انباشتن,به طور كلي شهرداري به دو دليل به مديريت مشاركتي نيازمند است : شريك شدن در كاميابي ها و نه انباشتن ناكامي ها ۲- پديدار شدن شهروندان و كاركنان دانشگر [۶] تعدد نهادهاي تصمیم گیري، اعمال مدیریت هاي موازي، عدم وضوح حیطه اختیارات و مسئولیت هاي هر نهاد و عدم هماهنگی میان نهاد هاي درگیر در مدیریت شهري موجب دامن زدن به مشکلات و ناکارایی سیستم مدیریت محیط زیست شهري شده است
چهارپاره,مریم  محمدخانی، پژوهشگر و منتقد ادبیات کودک و نوجوان، در این زمینه معتقد است  که جریانی که در سال‌های اخیر در شعر کودک به چشم می‌خورد، حجم تکرار در  وجوه مختلف این شعرهاست؛ مانند سرودن شعرها در قالب چهارپاره
تمثیل,و همچنین برگزاری مسابقات فرهنگی برای مراجعه و مطالعه مفاهیم بلند نهج البلاغه و استفاده از ظرفیت های ادبی و هنری برای انعکاس پیام ها در نهج البلاغه، در این کتاب کامل تربیتی تمثیل ها و حکایت های فراوانی ذکر شده است که این تمثیل های عبرت آموز به بهترین وجه قابل طرح از زبان هنر هستند
تمثیل,محمود بهمنی با تمثیل آب ذخیره شده در پشت سد به مثابه پول انباشته شده در بانکها، گفت : اگر آب پشت سد به صورت یکباره رها شود، سیل جاری خواهد شد و ویرانی به بار می آورد ولی اگر این آب پشت سد به صورت کانالیزه در بخش‌های مختلف تقسیم شود، ‌قطعاً شکوفایی خواهد داشت و ما هم در سال گذشته تلاش کردیم رشد نقدینگی به ورود در بخش تولید و صنعت کشور هدایت کنیم تا منافع بیشتری نصیب کشور شود
ترسیدن,و آن صفات عبارت است از : 1- ترسیدن و تكان خوردن دل در هنگام ذكر خدا، 2- زیاد شدن ایمان در اثر استماع آیات خدا، 3 - توكل، 4- بپا داشتن نماز ، 5- انفاق از آنچه كه خدا روزی فرموده است
ترسیدن,کد خبر: ۲۳۰۲۸۱   تاریخ انتشار: ۱۳۹۶/۰۵/۱۷ شد گفت قصد ترسیدن از تهدیدهای پیونگ یانگ را نداریم
تمثیل,یا مثلاً آیا می توان با چشمان باز عطسه کرد؟ و ما منتظر اولین عطسه هستیم ببینیم می توان با چشمان باز عطسه کنیم یا نه ؟ خب حتماً شما هم به اندازه کافی با این قبیل سرگرمی ها مواجه شده اید ، حالا ما نه می خواهیم شما را سر کار بگذاریم و نه اذیتتان کنیم ، بلکه می خواهیم برای رسیدن به یکی از تمثیل های زیبای قرآن کریم با هم یک آزمایش ساده را انجام دهیم ببینیم چه اتفاقی می افتد
ابادان,کلمات کلیدی : خودرو+منطقه آزاد اروند   ۱۳۹۴-۰۹-۲۹ ۲۳:۳۵:۰۴ خوشحالم که هموطنان عزیزمان در خوزستان از خودرو های ایمن و مدرن روز با قیمتهای مناسب استفاده میکنند انشاله بقیه مردم مملکت هم چنین امکانی پیدا کنند (3403749) (alef-11)   ۱۳۹۴-۰۹-۲۹ ۲۳:۳۸:۱۷ ولله قسم اگر به ساکنان ابادان و خرمشهر پنج تا از این خودروها هم مفتی بدن کمه سختی و رنجی که تو جنگ و بازسازی تحمل کردن تقریبا سه نسلشون درگیر مسائل اجتماعی دفاع مقدس بود (3403751) (alef-11) جی میشه مردم کل کشور بتونند این ماشینها رو سوار بشوند؟ واقعا تا کی تحمل؟! (3403799) (alef-11)   ۱۳۹۴-۰۹-۳۰ ۰۰:۰۷:۰۵ چقدر شبیه ماشین های ایران خودرو و سایپا هستند آدم به این کپی برداری شرکت های خارجی باید احسنت بگه (3403803) (alef-11)   ۱۳۹۴-۰۹-۳۰ ۰۷:۱۶:۳۶ بذارید لااقل مردم یه بخش از ایران طعم واقعی ماشین رو بچشن
طفیلی,اقتصادها که طفیلی ترین نوع کسب و کار در جهان
ایین,معنی کلمه Byelaw ایین‌ نامه‌، نظ‌امنامه‌، قانون‌ ویژه‌، قانون‌ فرعی‌ وضمنی‌
بلندشدن,ایستادن طولانی در یک وضعیت ثابت، یا به سرعت بلندشدن از وضعیت نشسته
خز,کارگردان فیلم‌هایی چون «چاقو در آب»، «تنفر»، «بن‌بست»، «قاتلین بی‌باک خون‌آشام»، «بچه رزماری»، «محله‌ چینی‌ها»، «پیانیست» و  «ونوس در پوست خز»، جدیدترین فیلمش را با عنوان «بر اساس یک داستان واقعی» در جشنواره کن ۲۰۱۷ به نمایش درآورد
جداشدن,سه شنبه 6 اسفند 1392 - 21:14:06 | کد مطلب: 250684 چاپ روزهايی كه وسايل اضافه را دور می‌ريزيم وقت جداشدن است کودک و نوجوان > فرهنگی - اجتماعی - نفیسه مجیدی‌زاده: اول: مادر، دو تا کارتن بزرگ جلو من گذاشت و گفت: «دیگه جا نداریم، باید نصفش رو بریزی دور؛ یعنی این دو تا کارتن باید بشوند یک کارتن
دریافتن,در اخبار انتشار یافته، خبر از ضرب و شتم شدید میان این دو نماینده و شکسته شدن سر منوچهر قاسم زاده و نیز خبر از جراحی شدن مغز وی داده می‌شد که خبرنگار تسنیم برای دریافتن میزان صحت این اخبار به سراغ رئیس شورای اسلامی آذربایجان‌غربی رفته و جویای اصل ماجرا شد
ارام,دندان‌پزشکی را انتخاب کنید که رفتاری دوستانه و شیوه درمانی ارام و بدون خشونتی داشته باشد
پیچاندن,وی در سال 1999 از یک تیغه روتور مولکولی برای پیچاندن مستمر در یک جهت استفاده کرد
ایین,گرامیداشت هفته هنر انقلاب در تبریز ایین گرامیداشت هفته هنر انقلاب به همت سازمان بسیج هنرمندان آذربایجان شرقی در مجتمع فرهنگی هنری 29بهمن تبریز برگزار شد
جداکردن,برای استفاده کافی است با جداکردن دو بخش این مکعب کوچک آن را به دو طرف باتری متصل کنید سپس آن را به گوشی متصل کنید
