word,sentence
سنجیدن,معاون امور  مهندسی و  توسعه شرکت ملی نفت ایران در ادامه سخنان خود ٢� عنوان از مسائل مهم مرتبط با قراردادهای نفتی در صنعت بالادستی نفت را تشریح کرد و گفت: نیاز به مطالعه عمیق و ارزیابی از پروژه های بالادستی، ارائه این پروژه ها در بردهای تخصصی و استفاده از دیدگاه کارشناسان، سنجیدن پروژه و بویژه رفتارهای مخزن با نرم افزارهای مختلف روز دنیا به طور مداوم ضرورت دارد
گماشتن,فعالان اجتماعی هندی با به کار گماشتن وکلای انگلیسی سعی دارند تا کوه نور را به هند بازگردانند
فکرکردن,در دنياي پُرتنش امروزي، چطور از استرس‌هاي هر روزه جان سالم به‌در ببريم؟ 30 دی 1395 ساعت 8:40 بعضي‌ها دست‌و‌پايشان را گم مي‌کنند و بعضي ديگر اشک مي‌ريزند؛ عده‌اي در سکوتي مبهم فرو مي‌روند و ديگراني هستند که قدرت فکرکردن را از دست مي‌دهند
گند,این دیگه چه نمره ای-گند زده به متا
جاافتاده,شکل‌گیری الگوهای رفتاری: بلافاصله پس از تولد، الگوهای رفتاری شروع به شکل‌گیری می‌کنند پس بسیار محکم و جاافتاده هستند
سیه,پا‍یان شب سیه: زندگی اینگونه است، همیشه سردترین و تاریک‌ترین لحظه‌ها درست قبل از سپیده است، اما اگر خود را از سقوط و نومیدی حفظ کنیم پاداش‌ها به زودی سرازیر می‌شوند
پزو,4 درصد و پزو مکزیک 1
امدن,پدر و مادر باید توجه کنند امدن فرزند جدید در کنار شور،نشاط و هیجانی که به خانواده می دهد  نباید آنها را از فرزند بزرگتر و  توجه به او غافل سازد
اهسته,4-حركات انتوئيد حركات اهسته، نا منظم‌، پيچشي هستند كه معمولا در انگشتان ظاهر مي شوند اما اغلب صورت و گردن را نيز در بر مي گيرند
اهسته,اسپاسم ها ، حركات كليشه اي اهسته تر و طولاني تر از تيك ها هستند
امدن,) آشنا کنند تا از به وجود امدن مشکلات زیاد جلوگیری شود
اوردن,وی افزود با اوردن سرمایه گذاران خارجی در واقع مدیریت و تکنولوژی را همزمان به کشور آوردیم ضمن اینکه برای دولت بدهی هم بوجد نیامده است
تمثیل,رییس پژوهشگاه میراث فرهنگی ادامه داد: در تمثیل و مثل های این مناطق تمام عناصر شکل دهنده کوهستانی و اعم از حیوانات، پدیده های طبیعی و
صادرکردن,این ضعف بزرگ کشور و در حقیقت صادرات ما را نشان می دهد، پیرو عواملی که ذکر شد ما نباید مواد اولیه را به صورت خام صادر کنیم، زمانی که صنایع پایین دستی نیازمند مواد اولیه هستند صادرکردن این مواد به خارج از کشور بی توجهی بزرگی نسبت به این صنایع است
واداشتن,ما از دولتهای اسلامی و عربی انتظار داریم از همبستگی مردمی ایجاد شده با مسجد الاقصی برای اتخاذ مواضعی همسو با خواسته‌های ملت فلسطین و ملت‌های اسلامی و عربی مبنی بر واداشتن رژیم غاصب صهیونیستی به توقف تجاوزات علیه این مسجد استفاده کنند
واداشتن,ما امروز مقابل فرصتی تاریخی برای واداشتن رژیم اشغالگر صهیونیستی به توقف تجاوزاتش علیه مسجد الاقصی و مداخله نکردن در امور آن از طریق تکامل تلاشها و اعمال فشارهای رسمی و مردمی بر این رژیم قرار داریم
درخشیدن,آیت  الله آملی لاریجانی با بیان اینکه اشتغالات دنیوی ما را غرق و غافل می کند  اظهار کرد: اگر چشمان خود را به روی نور مطلقی که در تمام عوالم در حال  درخشیدن است ببندیم قطعاً دچار حسرت و خسارت بزرگی خواهیم بود
تمثیل,مرة: 2:22 PM                         -                         1/18/2014 | طباعة لافروف یحذر الغرب من تهمیش المعارضة الداخلیة العربیه - حذر وزیر الخارجیة الروسی سیرغی لافروف الغرب من محاولة حصر تمثیل المعارضة فی جنیف بالاتئلاف السوری المعارض وتهمیش المعارضة الداخلیة
اهنگ,sepehr warrior از سال 1387 (9 سال) درجه گیمری student   اهل شوخی و رفاقتم/ یه روز اهنگ گوش ندم روزم شب نمیشه :دی  از بی جنبه ها متنفرم و هر چیزی رو به اندازش میدونم حتی شوخی رو   آدرس شخصی تنها برای دوستان قابل مشاهده میباشد!   ليست دوستان تنها براي دوستان در دسترس ميباشد!   ليست کلوب ها تنها براي دوستان در دسترس ميباشد! سیستم و کنسول های شخصی   اطلاعات سیستم شخصی تنها برای دوستان در دسترس میباشد!   دانشجو، روشنفكر، مامان جون مشوق بعد ميخواد سياسي شه ، پَ كون رو تشكه   Mortal Kombat X PS4 برایه اندروید دانلودش کردم و درحال بازی کردنشم به جرعت میتونم بگم یکی از خارق العاده ترین بازی های اندرویدی هست گرافیک/گیم پلی و هرچی که فک کنید تو بازی عالی انجام شده ولی بازی سحت هست و طولانی! خیلی! و همچنین کار تیمی در مبارزات حرف اولو میزنی و قابلیت اپگرید کرن سربازا در زمینه های مختلف بازی رو بی نهایت جالب کرده! و از عیب های بازی که تو ذوق هم میزنه به نظر من نداشتن fintalityدر اندروید هست و برای ps4هم حتما میخرم و هم برای x360در کل بازی بزرگی هست 9 Assassin's Creed Rogue Xbox 360 اخرین بازی ای که تموم کردم قبل این بازی ac black flag بود!!!!!! چون واقعا دیگه بازی برام نمونده بود! و بعد از اونم رفتم سراق این که دیدم عین عین همونه یعنی خدایی هیچ فرقی نکرده اصلا! جدا دارم راست میگم پولتونو الکی حروم یه بازی اینچنینی ای نکنید نمیدونم یوبیسافت بوقی چه فکری با خودش کرده اینو داده بیرو؟! اصلا و ابدا تو این بازی نو اوری ای نیست به هیچ وجه!!! مطمعن باشید بعد از انجام این بازی به حرفم پی میبرید الان دیگه جدا اساسینز زده شدم! با همین پول این بازی یه فارکرای 4 میخریدم حالشو میبردم! و 3
سیه,خوش بود گر محک  تجربه آید به میان                                     تا سیه روی شود هر که در او غش باشد          دکترمحمد صیادی نژاد   متخصص اعصاب و روان  فعال امور شهری و تعاون
امتیازدادن,حسن  که نسبت به گذشته یک وزن بالاتر آمده و در این یک سال ، خادم سعی کرده هم  امتیازدادن های حسن را اصلاح کند و هم حجم عضلانی او را تقویت کند ، در  رقابت با حریف روسش هم با همان هیجان بالا کشتیمی گرفت
خواباندن,بخش عقبی خودرو نیز برای حمل بار در مسافرت مناسب است و نزدیک به ۴۱۰ لیتر حجم دارد که با خواباندن صندلی سرنشینان عقب این حجم را تا ۹۱۷ لیتر افزایش می‌یابد
ایین,کد خبر: ۴۴۶۳۴   تاریخ انتشار: ۱۳۹۶/۰۱/۱۶ رئیس جمهوری در ایین افتتاح طرح های اقتصادی در سنندج: ها می تواند به 40 میلیارد دلار برسد رییس جمهوری
شتری,چون سپاه حر به نینوا رسیدند، ناگاه سواری بیامد بر شتری گزیده و سلیح درپوشیده و كمانی به دوش افكنده و بر حر سلام كرد و نامه‌ای از عبیدالله بدو داد كه: «چون این نامه به تو رسد، بر حسین ‌بن‌علی سخت‌گیر و او را بدان زمین كه از آب و گیاه بركنار بود، فرود آر و من رسول خویش را بفرمودم تا دیدبان تو باشد و چون فرمان من به امضارسانی، مرا باز گوید
نخودی,یا در دهه فجر برای برنامه‌هایی چون«عطر گلاب»بودم اما سینمایی  سه کار بود: «گربه آوازه‌خوان»، «نخودی» و سه کار «کلاه‌قرمزی» و  تلویزیونی‌ها هم مثل «بز زنگوله‌پا»، «هادی و هدی»، «خاله عنکبوت»، «موش  نمکی» و «جقجقه و فرفره»، «جینگیل و فینگیل» و
سیه,مرگ 2 شهروند جمهوری آذربایجان در ایران مدیر آتش نشانی و امداد و نجات منطقه آزاد ارس گفت: در اثر برخورد دو دستگاه خودروی سواری لادا و پژو 405در محور جلفا- سیه رود، دو تبعه جمهوری آذربایجان جان باخته و 6 نفر هم مصدوم شدند
سیه,محور  ارتباطی جلفا- سیه رود از به دلیل باریکی و پیچ های خطرناک از مسیرهای  حادثه خیز و پرخطر آذربایجان شرقی در شمال ان محسوب می شود
ایین,کد خبر: ۴۴۹۱۳   تاریخ انتشار: ۱۳۹۶/۰۱/۲۶ رئیس جمهوری در ایین افتتاح طرح های اقتصادی در سنندج: امنیت ملی است باید قوه قضاییه و نیروهای امنیتی همکاری
فتوکپی,از جمله معرفی دستگاه‌های فتوکپی چندکاره این شرکت که برای اولین بار در اندازه A3 طراحی شده‌اند
دریافتن,المللی همچنان در پی دریافتن این امر است که چگونه
نخودی,ج) ریز ریز و نخودی می‌خندید
خمار,مرد خمار با عضلات وارفته و پوست نمور و صورت سیاه درهم کشیده‌اش داد می‌زند: «دیدی خریدار نیستی، مردم آزاری، خواستی خمارترم کنی
درخشیدن,به نوشته گاردین، این سکه ها نخستین نمونه در نوع خود در جهان محسوب می شوند که ویژگی مهم و جذابی همچون درخشیدن در شب را دارند
ترسیدن,خوب یا بد، در حال حاضر این ژانر باب میل افرادی هست که به شکل مازوخیستی به ترسیدن علاقه دارند و ترسیدن به یک نیاز حیاتی و غیر قابل سرکوب در آن‌ها تبدیل شده است
ترسیدن,در Daylight سازنده به خوبی در ابتدای بازی بستر لازم برای ترسیدن مخاطب را محیا می‌کند
دریافتن,شاید برای دریافتن اصل موضوع بد نباشد مراجعه ای به اصل قانون هدفمندی یارانه ها صورت گیرد
کشدار,دقیقه ها را می شمارد و پیش خود می گوید لعنت بر دقیقه های کشدار، چرا زمان نمی گذرد؟ بیشتر از گذشته دلش می خواهد مقابل زندگی بنشیند و با او بگومگو کند؛ یک سالمند که تصمیم خود را گرفته است و حتی نمی خواهد قدمی کوچک به سمت زندگی و در اجتماع بودن بردارد
خمار,نمی‌دانم یک چشم خلیجی خمار دقیقا کدام قسمت عشق را نشان می‌دهد اما روی  همه نیمکت‌ها یک چشم می‌کشیدم که پشت یک نخل خرما در غروب محو شده و زیرش  با خط نستعلیق می‌نوشتم «امیر»
طفیلی,مرحوم جلال درست تشخیص داده بود که فارق میان غرب و سایر ممالک، اهل تولید بودن یا مصرف کننده بودن است زیرا اقتصاد تولیدمحور، روحی تازه بر سایر جوارح اجتماع می‌دمد: اول: اقتصاد طفیلی غرب یا شرق، نمی‌تواند سیاست مستقل از غرب یا شرق را پشتیبانی کند بلکه سیاستمدار را به زبونی و دریوزگی می‌کشاند
سیه,برخی از آثار هنری همفری بوگارت: برادوی این گونه است - 1930 یک شیطان با زنان - 1930 زنان تمام ملل - 1931 دهه 20 پرجنب و جوش - 1939 شاهین مالت - 1941 در تمام طول شب - 1943 کازابلانکا - 1943 گنج‌های سیه را مادره - 1948 به هر دری بزن - 1949 توکیو جو - 1949
خواباندن,مدیر اداره نظام‌های پرداخت بانک مرکزی تأکید کرد: با عملیاتی شدن طرح صیاد و انتشار چک‌های موردنظر بانک مرکزی، هر فردی با در اختیار داشتن آن چک به هر خودپردازی برود چک خوانده می‌شود و در همان لحظه رسید خواباندن چک در حساب از طریق خودپرداز قابل دریافت خواهد بود
سیه,این بازیگر بلند قد و سیه‌چرده سینما با سابقه‌ای طولانی در نقش‌های مکمل و دوم توانسته به عنوان یکی از قطب‌های کاراکترهای فرعی در هالیوود خودش را تثبیت کند
سیه,که مسبب تمام بدبختی ها و سیه روزی های من
افسونگر,چهارشنبه 21 اسفند 1392 - 00:32:44 | کد مطلب: 252840 چاپ آشنایی با ژانر انیمیشن سینما و تلویزیون > سینمای‌ جهان - مهدی تهرانی: دنیای خیالی و افسونگر پویانمایی از بدو پیدایش سینما تاکنون ماجراجویی‌های بی شماری برای علاقمندان به هنر هفتم خلق کرده است
سنجیدن,وی افزود: مدیریت این شاخص یکی از بزرگترین چالش های سیستم بانکی و اقتصاد کشور محسوب می شود و دولت همواره با سنجیدن اوضاع اقتصادی، وضعیت عرضه و تقاضا، هزینه‌ها، تولید و
جابهجا,۸ میلیون نفر درحومه تهران و بقیه مراکز کلان شهرها  با این خطوط جابهجا شدند و امسال این رقم به ۷ میلیون نفر می رسد و  هدف ماجابه جایی ۲۵ میلیون مسافر در سال با این خطوط ریلی است
ایین,برخی از بند‌های ایین‌نامه مذکور به شرح زیر است: تاخیرات پرواز: در صورت بروز تاخیر در انجام پرواز بر اساس زمان درج شده در بلیت مسافر، اقدامات ذیل می بایست توسط شرکت هواپیمایی انجام شود
ترسیدن,وقتی  زنی عرق مردی را که از دیدن ویدئو ترسید بو کرد، به احتمال بیشتری حالت  چهره‌اش شبیه به چیزی مانند ترسیدن بود
قرمزشدن,بعضی از انواع پروستاگلاندین ، باعث التهاب مفاصل می شود كه علائم این التهاب شامل قرمزشدن، تورم، خارش و درد است كه وضعیت آرتریت را بدتر می كنند
امدن,به گزارش پایگاه اطلاع رسانی دولت، حجت الاسلام و المسلمین دکتر حسن روحانی در فرودگاه نورخان مورد استقبال مقامهای پاکستانی و سفیر و مقامهای سفارت جمهوری اسلامی ایران در اسلام آباد قرار گرفت و همزمان با پایین امدن رییس جمهوری اسلامی ایران از پلکان هواپیما، ٢١ گلوله توپ نیز به افتخار ایشان شلیک شد
واداشتن,"هنر محیطی که طی سال های دهه 1960 به تدریج رواج یافت، اساسا بر درگیر کردن بیننده با اثر هنری مبتنی بود و در آن محیط‌ها به قصد واداشتن بیننده به شرکت در""اتفاقات"" یا ""بازی"" به نحو استادانه‌ای کار می‌شد"
سیه,سقوط موتورسیکلت به دره در جلفا جان دو جوان را گرفت مسئول روابط عمومی اورژانس آذربایجان‌شرقی گفت: سقوط موتورسیکلت به دره در محور جلفا سیه رود جان دو جوان را گرفت
ضربی,« سیامک جهانگیری » که تدوین و آوانویسی این کتاب و قطعات آن را با نی اجرا کرده در مقدمه‌ی این کتاب نوشته است: «فرم چهارمضراب به دلیل داشتن پایه‌های ریتمیک بیشتر برای سازهای مضرابی متداول است اما در آثار استاد صبا وجود ملودی‌های ناب بر بستر این پایه‌های ریتمیک و فضای ملودی‌محور باعث می‌شود ضربی‌ها و چهارمضراب‌های او برای تمامی سازها قابل اجرا باشد
خواباندن,فضای صندوق عقب 206SD خوب و راضی کننده است اما در برابر تندر90 کوچکتر  است ولی به علتی که صندلی‌های عقب 206 قابلیت خواباندن دارند می‌توان اجسام  طویل‌تری با آن جابه جا کرد
ضربی,در بخش دوم دستگاه همایون اجرا شده است و در گوشه‌های مختلف آن قطعات متر‌آزاد و ضربی شنیده می‌شود
ایین,تغییر ذائقه در ارتفاع ! رییس ارشد طرح و برنامه کترینگ این شرکت هواپیمایی درباره گلایه مسافران از کیفیت ایین غذاها، اظهار کرد: تحقیقات نشان می‌دهد که معمولا روی ارتفاع 30 هزار پا 99 درصد ذائقه‌ها تحت تاثیر جو قرار می‌گیرد و مسافران مزه واقعی غذا را حس نمی‌کنند، یعنی اگر همان غذا را برای مسافر روی زمین سرو کنیم با میل و رغبت بیشتری از آن استقبال می‌کند
ریزریز,» خندید؛ ریزریز و صمیمی
سیرکردن,پول که بریزند می‌رود جای قرض‌وقوله‌هایی که برای سیرکردن شکم خودمان کرده‌ایم
ضربی,من هم در یکی از کارهایم در «سرخانه» از ریتم 38 ضربی استفاده کرده‌ام اما شک دارم که این کار در آینده پایدار بماند اما آنچه باقی می‌ماند سیستم ریتمیکی است که در سرخانه از آن استفاده کرده‌ایم وگرنه هر ریتمی فقط جرقه‌ای است در کار یک آهنگساز که دیگر تکرار نمی‌شود
شتری,کد خبر: ۴۶۹۹۳   تاریخ انتشار: ۱۳۹۶/۰۵/۱۳ شتری در باغات هلو · مبارزه با کرم سیب و
پزو,به گزارش پایگاه خبری تحلیلی « میهن صنعت »، تفاوت هایی که در ظاهر پزو 208 نسبت به 207 رخ داده طراحی چراغهای جلو و عقب ، پنجره کناری و محل اتصال آینه ها می باشد
تمثیل,بی جا نیست که خواجو نام مذکر همایون را برای معشوقه و نام مؤنث را برای همای عاشق انتخاب کرده است و این تغییر جنس اسم عاشق و معشوق به احتمال خیلی قوی عمدی ست و تمثیل روحانی داستان عاشقانه را پررنگتر می‌کند، چراکه نفس مؤنث است و خدا مذکر
ضربی,در بخش اول بابک راحتی با نگاه فرمال و محوریت دستگاه ماهور و استفاده از مایه های همجوار آن قطعات ضربی و تصانیف زیبایی ساخته است که البته بنده همچون اثار دیگرم تلاش کردم این رویکرد را در بخش غیر متریک نیز حفظ کنم
شیلینگ,در این زمان، واحد پول انگلستان پوند استرلینگ (برابر با 20 شیلینگ) بود و یک تومان ایران معادل ده پوند انگلستان ارزش داشت
جاافتاده,برای کشورهایی مانند ما که شرایط‌ آنها شرایط جاافتاده‌ای نیست، ماجرا تا حدودی متفاوت است
ضربی,در اجرای گوشه ها ، پیش درآمدها و قطعات ضربی با شدت و ضعف و فورته و پیانویی که روی نتها ، جملات و حالتهای موسیقی انجام می دهد زیبایی خاصی به آن می بخشد
جگری,کد خبر: ۲۵۲۹۳   تاریخ انتشار: ۱۳۹۴/۰۷/۲۶ عدسی ۹۵۰۰ تومان نخود ۶۵۰۰ تومان لوبیا جگری ۷۵۰۰ تومان
تمثیل,به غیر از تمبر حافظ تمبر تمثیل امام خمینی (ره) نیز در دو مدل طلا و نقره تولید شده است
تمثیل,به غیر از تمیر حافظ تمیر تمثیل امام خمینی (ره) نیز در دو مدل طلا و نقره تولید شده است
ضربی,سقف این ایوان تاق ضربی بزرگی است که تزئینات مربع شکل تودرتو دارد
گماشتن,بررسی تحولات پس از سرنگونی صدام در موضوع گماشتن حاکمان آمریکایی بر یک ملت مسلمان، وتوی نظر رهبران سیاسی جامعه، دخالت در انتخابات و تلاش برای اعمال نظر در نگارش قانون اساسی و امور نظامی این کشور از جمله رهاوردهای حضور آمریکا بود
اوردن,کد خبر: ۸۹۰۱۰۸۲   تاریخ انتشار: ۱۳۹۶/۰۵/۲۲ مسئول بسیج سازندگی سپاه امام حسن مجتبی(ع)؛ کمک کردن به دولت وظیفه اصلی بسیج سازندگی/بالا اوردن سطح کیفیت، معیشت و رضایتمندی مردم در اولویت کار بسیج است سرهنگ ترکاشوند گفت امروز فعالیت های بسیج سازندگی در میان
خواباندن,فضای بار عقب 2008 درحالت عادی به 360 لیتر می‌رسد حال آنکه با خواباندن صندلی‌های جلو این فضا تا حدود 1194 لیتر هم افزایش می‌یابد
سیه,این منطقه هنگامی اهمیت یافت که جنگ معروف چالدران بین شاه اسماعیل صفوی و سلطان سلیم خلیفه عثمانی، در منطقه سیه چشمه در گرفت
پرکننده,فیلم هایی که خودم هم نمی پسندم بخش  زیادی از نوجوانی و جوانی من در این عرصه گذشته و تاثیری که این حرفه در  زندگی شخصی هر بازیگر دارد، آنقدر پرکننده است که نمی تواند برایش حتی  قیاسی داشت اما واقعیت این است که وقتی می بینم کاری را از بین چندین  پیشنهاد انتخاب کرده ام- چون فکر می کنم با توجه به عواملش خروجی خوبی  داشته باشد- ولی در نهایت همان یک کار هم وقتی روی پرده سینما می رود آنقدر  بد است که خودم هم حاضر نیستم آن را ببینم، ترجیح می دهم باز هم کمتر از  آنچه در این دو، سه سال انتخاب کرده ام، انتخاب کنم
پزو,فرد مظنون 113 میلیون پزو (226 هزار دلار) تراشه های بازی های این مجموعه تفریحی را که سرقت کرده بود در یک کیسه با خود حمل می کرد
