word,sentence
ضربی,احتشامی اضافه کرد: قطعات ضربی در این بخش با دف رضا دربندی و تنبک احسان بزرگمهر اجرا می‌شود و مقدمه‌ی کار را که تصنیف «فروغ زندگی» نام دارد، خودم ساختم که تم ارمنی دارد و با ترانه‌هایی از بامداد جویباری اجرا خواهد داشت
ضربی,این قطعه هم از همایون شروع می‌شود و به مخالف سه‌گاه می‌رسد مجید درخشانی درباره دیگر بخش‌های این آلبوم گفت:کاری در دشتی روی شعر درخت شادروان سیاوش کسرایی  و قطعات ضربی و تصانیفی روی شعری از عطار«ای بلبل بینوا فغان کن» در ابوعطا از دیگر بخش‌های این آلبوم است
پزو,���بزرگ ترین سقوط ارزهای نوظهور در پنج سال گذشته��ارزش پزوی آرژانتین 23 درصد در ژانویه کاهش یافت که بزرگ ترین کاهش از بحران مالی سال 2002 این کشور بود و به دلیل تصمیم بانک مرکزی برای توقف مداخله در بازارها برای پشتیبانی از پزو روی داد زیرا مداخله مذکور هزینه بالایی داشت و ذخایر ارزی خارجی کشور را تقلیل داد
پزو,آرژانتین هرگز بر بحران پزو غلبه نکرد در حالیکه فاقد مبنای صنعتی برای احیای پایدار بوده است
جداکردن,جداکردن حبوبات از مهارت هایی است که به دست ورزی کودکان کمک می کند و در منزل قابل اجراست
ساییدن,"کد خبر: ۳۹۶۶۵   تاریخ انتشار: ۱۳۹۵/۱۰/۲۹ معرفی و بررسی کتاب ""ارزیابی مشارکتی روستایی"" (انسان‌شناسی روستایی) پنهانند آن ها مشغول ساییدن کشک هستند یا جمع کردن"
تاباندن,کد خبر: ۵۵۱۰۵۹   تاریخ انتشار: ۱۳۹۵/۰۷/۲۵ جای روشنگری و تاباندن نور به دخمه قاچاقچیان حرفه‌ ای
گند,مگر روزگار قبل از نفوذ مدرنیته، چه اشکالی داشت؟ جز این بود که باید کمی بیشتر زحمت می‌کشیدیم تا چرخ زندگی‌مان بچرخد؟ در عوض، اینقدر دست درازی به طبیعت، وجود نداشت و تا این حد محیط زیست‌مان را به گند نمی‌کشیدیم
طفیلی,کد خبر: ۱۷۳۴۵۲   تاریخ انتشار: ۱۳۹۶/۰۵/۲۰ از خطبه های نماز جمعه علی طفیلی معاون تبلیعات دفتر
گند,بهترین هاش  که Spider-Man نسخه PS1 بود که تو دوره خودش واقعا فوق العاده بود همچین بازی اونم در نسل پنجم!(کسایی که تجربه کردن متوجه میشن منظورم رو) بعدش Spider-Man نسخه PS2 بود که تقریبا اتفاقات فیلم اول Spider-Man رو با تغییراتی در داستان(نسخه 2002) عرضه کردن که در شروع این بازی در نسل ششم خوب ظاهر شد و شخصا باید بگم اکتیوژن گند نزد به این بازی(میدونم تعجب کردید اکتی قبلا گند نمیزد به چیزی) بعدش نسخه Spider-Man 2 بود که از نظر من بهترین بازی ساخته شده از Spider-Man بود
خواباندن,کمی لالایی، تعریف چند داستان، کمی تلاش و کلنجار برای خواباندن کودک روی پا، دراز کشیدن در کنار کودک، نوازش کودک، بی‌­محلی کردن به کودک و بستن چشم­ها به منظور تشویق او به بستن چشم‌­ها، بستن در برای جلوگیری از خروج کودک از اتاق و در نهایت داد زدن بر سر او و عصبانیت از این­که چرا در حالی که ساعت حدود ده است! او هنوز نخوابیده
خواباندن,دو تا شش ماهگی واقعیت این است که بین دو ماهگی تا شش ماهگی روش خواباندن ما می­‌تواند به فرزند ما یاد بدهد که تا حدود سه سالگی به چه شکلی به خواب برود
علفی,به وضعیت مناسب بارش ها و افزایش پوشش علفی کف
شتری,حیات وحش در استان خراسان شمالی، تنوع جانوران و گونه‌های مختلف پستانداران، پرندگان، آبزیان و خزندگان مانند قوچ، میش، پلنگ، یوزپلنگ، آهو، سمور، گرگ، کبک، عقاب، تیهو، فاخته، پلیکان، فلامینگو، مار شتری، مار آتشی و مار قیطانی، از ویژگی‌های این استان به شمار می‌آید
سیه,به  گزارش ایسنا، «جیوانا آرتی» رئیس آژانس گردشگری «سیه‌را» در شهر پاریس که  برای شرکت در نمایشگاه بین المللی گردشگری و صنایع وابسته در تهران است،  اظهار کرد: خوشحالم که مردم ایران با سرمایه‌های شخصی خودشان خانه‌های  تاریخی و بناهای قدیمی را حفظ می‌کنند و در این راه جایی مانند صندوق احیا و  بهره‌برداری از بناها و اماکن تاریخی و فرهنگی به آنها در مرمت و  بهره‌برداری از این بناها کمک می‌کند
فتوکپی,به گزارش صبحانه ، امروزه کمتر ساختمان تجاری را می‌توان پیدا کرد که در آن از چراغ‌های گوناگون، تابلوهای تبلیغاتی بزرگ با روشنایی‌های مختلف و متعدد و همچنین انواع دستگاه‌های الکتریکی و الکترونیکی نظیر رایانه، چاپگر، اسکنر و فتوکپی استفاده نشود
گماشتن,اطرافیان ترامپ به دنبال تغییر رئیس کل بانک مرکزی آمریکا تاریخ انتشار : يکشنبه ۴ تير ۱۳۹۶ ساعت ۱۶:۱۸ در حالی که بانک مرکزی آمریکا سال‌هاست تلاش می‌کند تا خود را به دور از رقابت‌های سیاسی نگه دارد، اما به نظر می‌رسد برخی اطرافیان ترامپ به دنبال تغییر رئیس کنونی و گماشتن مهره خود در این سمت هستند
گماشتن,در حالی این مشاوران به دنبال برکناری یلن و گماشتن گزینه موردنظر خود هستند که پیشتر رئیس خزانه‌داری آمریکا اعلام کرده بود که دولت ترامپ به دنبال تغییر رئیس کل بانک مرکزی این کشور نیست
ضربی,حیاط بزرگ ساد‌ه‌ای با طاق بلند‌ ضربی نیز د‌ر طرف شرقی این کاروانسرا وجود‌ د‌ارد‌
فراگرفتن,اگر قبل از اینکه بتواند راه برود برایش سه چرخه بخریم و همچنین اینکه بتواند سوار آن شود یک دوچرخه برایش تهیه کنیم و قبل از فراگرفتن فن رانندگی برایش ماشین بخریم و قبل از اینکه قدر و ارزش پول را بداند یک انگشتر الماس به او بدهیم، او این هدایا را با اندک لذتی قبول می کند و با تصاحب آنها کمتر قدردانی می نماید
انباشتن,باغدار دیگر نهالی نمی‌کارد و به امید میوه دادن نمی‌نشیند، کشاورز بذری  نمی‌پاشد تا محصولی درو کند و دامدار بز و گوسفندی برای چرا نمی‌برد تا  گوشت و شیر و محصولاتی روانه بازار کند، این یعنی روستایی هم باید به سوپر  مارکت برود و از نانوایی نان بخرد اما چه کسی برای انباشتن سوپرمارکت‌ها و  داغ شدن تنور نانوایی‌ها تولید خواهد کرد؟ یکی از روستاییان محمود آباد مازندران که سن و سال زیادی ندارد می‌خواهد  زمین‌های کشاورزی‌اش را در کمترین زمان بفروشد، زمین را به 5قطعه هزار متری  تقسیم کرده و قیمت را 30میلیون گذاشته و امیدوار است با فروش آنها به شهر  برود و برای خودش کار و کاسبی راه بیندازد
حنبلی,قشقاوی تصریح کرد: به لحاظ مبنای فقه شیعه جعفری با فقه حنبلی که مبنای حقوقی حکومت عربستان است ، شباهت های زیادی دارد
حنبلی,وی در این خصوص خاطر نشان کرد:غرامت موضوعی است که فقه شیعه جعفری و فقه حنبلی نظر یکسانی با عنوان «قتیل الزحام» وجود دارد
حنبلی,قشقاوی همچنین تاکید کرد: براساس فقه شیعه و فقه حنبلی خارج از شناخت مسئول مشخص واقعه پرداخت دیه از بیت المال پذیرفته شده است علاوه براین برردولت عربستان پرداخت دیه یا غرامت واجب است و این موضوع هیچ ارتباطی با پیگیری مجرمیت ندارد
ضربی,به طور کلی پوشش سقف تمام قسمت‌های بازار، دارای طاق‌های ضربی و گنبدی آجری است و نورگیرهایی در سرتاسر آن و در دو طرف حجره ها تعبیه شده است
سنجیدن,برای طلاق همواره ۵ تا ۶ عامل را بر می شمارند که یکی از آنها جزئی نگری و ریزبینی و دیگران را با خط کش خود سنجیدن است
ضربی,کاروانسرای میرفتاح به کاروانسرای حلاج‌ها معروف است که در غرب راسته اصلی بازار ملایر توسط دالانی با طاق ضربی به آن متصل شده و سایر کاروانسراها با آجر، خشت و ملاط گل ساخته شده است
ضربی,این بنا در 2 طبقه ساخته شده که طبقه زیرین تمامأ با طاق‌های ضربی و خشتی ساخته شده‌است
مسیله,با عبور رود شور از این نمکزار بر شوری این آب افزوده شده و در پل عاصف الدوله در نزدیکی پلیس راه ماهدشت کاملاً شور شده و به طرف جنوب شرقی جریان می یابد و نهایتاً به حوضه آبریز دریاچه مسیله قم می ریزد
ضربی,این مُهر ایرانی بودن در چیست؟ یعنی چطور برای جوانی که کمانچه می نوازد باید اتفاق بیفتد؟ خب موسیقی هایی که از قدیم برای ما به ارث رسیده مثل ردیف، موسیقی محلی، قطعات ضربیِ اساتید و
ضربی,شریفی همچنین گفت: پرداختن به اصالت آواز در این اثر برای ما از اهمیت ویژه‌ای برخوردار است و قطعات موسیقی طوری انتخاب شده‌اند که جان تازه‌ای با توجه به چهارمضراب ،‌ ضربی‌ها و
فتوکپی,میز نشسته اند آدرس فتوکپی را می پرسم و کم
جاافتاده,اکثر آن ها مجبورند در دوران کودکی نقش انسانی بزرگ و جاافتاده را ایفا کنند
جگری,به تویوتاهایی جگری رنگ داشت که با خطوط قرمز نارنجی
فتوکپی,مدارک موردنیاز: -مدارک احراز هویت  - فتوکپی سند مالکیت (هر نوع سندی که مالکیت مشتری را محرز نماید) ملک مورد تعمیر یا تکمیل
طفیلی,کد خبر: ۳۸۹۸۸   تاریخ انتشار: ۱۳۹۵/۱۰/۱۴ گفت‌وگو ایانا با دکتر اسدالله نقدی پیرامون علل مهاجرت از روستا به شهر تشدید مهاجرت از روستا به شهر با تغییر اقلیم/ روستاها از نیمه‌جانی به بی‌جانی رسیده‌اند/ با ورود نفت به اقتصاد ایران روستاها طفیلی شهر تصور شدند/ در سال 1400 دوسوم جمعیت ایران شهرنشین خواهد شد مهاجرت روستاییان به شهر و سپس ایجاد شهرک های اقماری
شتری,به گزارش ایسنا، توصیه‌های هواشناسی کشاورزی برای روز دوشنبه تا روز چهارشنبه سوم( ۱تا ۳ خرداد ماه) در سراسر کشور به شرح زیر است: •استان‌های آذربایجان شرقی، آذربایجان غربی و زنجان: •باغبانی: •احتیاط در انجام عملیات سم‌پاشی و محلول‌پاشی در ساعات بعدازظهر به دلیل وزش باد و بارش در روز چهارشنبه •اطمینان از استحکام گلخانه‌ها و تاسیسات و عدم آبیاری سنگین باغات و استفاده از قیم با توجه به پیش‌بینی وزش باد •آماده‌سازی زمین برای انتقال نشاء گوجه فرنگی تا روز سه شنبه •کنترل دما و تهویه انبارهای نگهداری محصولات کشاورزی از جمله سیب‌ زمینی و پیاز به دلیل نوسانات دمایی و روند افزایش دما •اجرای عملیات بچه‌گیری در نهالستان‌ها، کوددهی و وجین علف‌های هرز در نهالستان‌ها •مبارزه با انواع بیماری شانک در باغات میوه و مبارزه با پوسیدگی ریشه در مزارع پیاز تا روز سه شنبه و در ساعات ابتدایی روز •مبارزه با شته سبز و سفیدک سطحی در باغات میوه تا روز سه‌شنبه و در ساعات ابتدایی روز •مبارزه با لب شتری در باغات هلو، مبارزه با شپشک واوی در باغات سیب و مبارزه با تریپس در باغات انگور تا روز سه شنبه و در ساعات ابتدایی روز •ردیابی شب پره مینوز گوجه فرنگی در گلخانه‌ها و خزانه‌ها و مبارزه با جوندگان مضر کشاورزی با نظر کاشناسان •زراعت: •پایش مزارع گندم و جو در خصوص بیولوژی پوره سن غلات •مبارزه با سوسک پولن کار در مزارع کلزا سم‌پاشی خزانه ها جهت مبارزه با شپره مینوز گوجه فرنگی تا روز سه‌شنبه و در ساعات ابتدایی روز •استفاده از علف‌کش‌های قبل از کشت در مزارع  ذرت تا روز سه‌شنبه و در ساعات ابتدایی روز •بازدید مزارع کلزا در خصوص شته و انجام عملیات سم‌پاشی تا روز سه‌شنبه و در ساعات ابتدایی روز •انجام عملیات وجین و مصرف کود سرک در زراعت‌های بهاره از جمله چغندر قند، پیاز، سیب زمینی و ذرت •مصرف کود سرک در زراعت‌های پاییزه (گندم، جو و کلزا) آبی همراه با آب آبیاری •ادامه عملیات خاک‌ورزی و آماده‌سازی بستر و کاشت ذرت تا روز سه شنبه •مبارزه با سس در مزارع چغندر قند و مبارزه با کک در مزارع چغندر قند تا روز سه‌شنبه و در ساعات ابتدایی روز •دامداری و طیور: •تنظیم دما و بهبود شرایط تهویه در اماکن دام و طیور در مرغداری‌ها و گاوداری‌ها •زنبورداری: •محافظت از کندوها به وسیله روش‌های مرسوم و بازبینی کندوها در مقابل رگبارهای بهاری •انتقال کندوهای زنبورعسل به مزارع کلزا و احتیاط در روز چهارشنبه •استان اردبیل: •باغبانی: •احتیاط در انجام عملیات سم‌پاشی و محلول‌پاشی به دلیل وقوع بارش باران و وزش باد از چهارشنبه به بعد •اطمینان از استحکام گلخانه‌ها و تاسیسات و عدم آبیاری سنگین باغات و استفاده از قیم با توجه به پیش‌بینی وزش باد •تنظیم دمای گلخانه‌ها و کارگاه‌های پرورش قارچ به دلیل افزایش دما  •تسریع برای تلقیح بیشتر با استفاده از زنبورعسل در باغات بارده با توجه شرایط مساعد جوی تا روز سه‌شنبه •زراعت: •پایش در مزارع غلات در خصوص بیماری‌های قارچی از جمله زنگ زرد، فوزاریوم و پاخوره تا روز سه‌شنبه •مصرف کودهای ازته در مزارع کلزا و غلات به‌صورت سرک تا روز سه‌شنبه •کاشت زراعت‌های بهاره بعد از گاورور شدن اراضی تا روز سه‌شنبه •دامداری: •تنظیم دمای  مرغداری‌ها، دامداری‌ها و انبارها به دلیل نوسانات دما  •زنبورداری: •انتقال کندوها به نواحی اطراف مزارع و باغات و احتیاط از روز چهارشنبه به بعد •محافظت از کندوها به وسیله روش‌های مرسوم و بازبینی کندوها در مقابل باد به ویژه از چهارشنبه به بعد •شیلات: •تنظیم جیره غذائی در مزارع پرورش ماهی بر اساس شرایط وضع هوا •استان‌های کرمانشاه، کردستان، همدان، لرستان، چهارمحال و بختیاری و کهگیلویه و بویر احمد:  •باغبانی: •احتیاط در انجام عملیات سم‌پاشی و محلول‌پاشی تا روز سه‌شنبه •دوغ آب زدن پوشش سقف سالن‌ها و گلخانه‌ها جهت کاهش اثرات افزایش دما •مبارزه با شته‌ها و گرده‌خوارها در باغات تا روز سه شنبه  •مبارزه مکانیکی با علف‌های هرز مزارع نخود بهاره و پاییزه و مبارزه با شپشک واوی در باغات سیب تا روز سه شنبه  •محلول پاشی کودهای ریزمغذی مورد نیاز (براساس نتایج آزمون خاک) در باغات میوه •مبارزه به موقع با پروانه مینوز گوجه فرنگی طبق توصیه کارشناسان تا روز سه‌شنبه  •زراعت: •مبارزه با شته‌ها و گرده‌خوارها در مزارع کلزا تا روز سه‌شنبه  •مبارزه با پوره سن گندم تا روز سه‌شنبه  •پایش مزارع چغندرقند از نظر کک چغندرقند •ردیابی بیماری زنگ زرد گندم و در صورت لزوم مبارزه با آن تا روز سه‌شنبه  •شروع کشت ذرت دانه‌ای و علوفه‌ای با استفاده از ارقام مناسب به ویژه رقم سینگل کراس ۷۰۴ از سه‌شنبه به بعد •مبارزه با علف‌های هرز پهن برگ و باریک برگ غلات و در ساعات خنک و آرام روز و از روز سه شنبه  •دامداری: •تنظیم دما و بهبود شرایط تهویه در اماکن دام و طیور به دلیل نوسانات دما •زنبورداری: •محافظت از کندوها به وسیله روش‌های مرسوم و بازبینی کندوها در ساعات گرم رو •انتقال کندوها به نواحی اطراف باغات •استان مازندران:  •باغبانی: •احتیاط در انجام عملیات سم‌پاشی و محلول‌پاشی از سه‌شنبه به بعد به دلیل بارش پراکنده و وزش باد •محلول‌پاشی عناصر غذایی متناسب با نیاز درختان تا روز سه‌شنبه •کوددهی ریشه‌ای درختان مرکبات و محکم کردن قیم نهال‌های جوان •کنترل مکانیکی علف‌های هرز مزارع پیاز تا روز سه‌شنبه •کنترل شیمیایی بیماری‌ها و شته در درختان سیاه‌ریشه تا روز سه‌شنبه •کنترل شیمیایی علف‌های هرز مزارع پیاز تا روز سه‌شنبه •زراعت: •کنترل و هوادهی مناسب و موثر خزانه‌های برنج دارای پوشش نایلونی (با توجه به تغییرات دمای محیط) •برداشت از مزارع آماده نخودفرنگی، باقلا، سیرسبز و سایر سبزیجات تا روز سه‌شنبه •اقدام به کشت ذرت، سورگوم، یونجه، پنبه و نشاء صیفی‌جات (خیار، گوجه فرنگی، هندوانه، بادمجان و
یکسر,باعث می شود نسبت به رانندگان آژانس ها که یکسر
جداکردن,در برشی دیگر به‌نظر می‌رسد جداکردن تابلوهای راهنمای خیابان‌ها و کوچه‌ها با نظارت سازمان میراث‌فرهنگی از بدنه آثار تاریخی ثبت‌شده و نصب آنها روی پایه‌های ایستاده چندان هزینه‌ای را به سازمان حمل‌ونقل و ترافیک تحمیل نمی‌کند
ضربی,طبقه زیرین تمامأ با طاق‌های ضربی و خشتی ساخته شده‌است
تمثیل,اما برای بهره‌گیری بیشتر از تمثیل «رقابت سیاسی کاندیداها» در قالب «رقابت‌های اقتصادی شرکت‌ها»، فرض کنید شرکت سامسونگ، در برنامه تبلیغات تلویزیونی مربوط به جدیدترین گوشی موبایل تولیدی خود، اصلا و ابدا صحبتی درباره قابلیت‌های آن محصول به میان نیاورده و 100 درصد برنامه تبلیغاتی را به ذکر محسنات و ویژگی‌های شخصیتی جذاب «مدیران ارشد سامسونگ» اختصاص دهد و مثلا فقط بگوید که مدیران رده بالای شرکت سامسونگ بسیار «خندان» و «سحرخیز» هستند، ارزیابی بینندگان از این برنامه تبلیغاتی چگونه خواهد بود؟ باز هم فرض کنید که همین شرکت، در یک برنامه تبلیغاتی تلویزیونی دیگر خود، به‌جای آنکه مثلا به ذکر برتری‌ها و قابلیت‌های جدیدترین گوشی موبایل تولیدی خود بر جدیدترین گوشی‌های موبایل «اپل» بپردازد، کل آن برنامه تبلیغاتی تلویزیونی را به ذکر نیت‌های بد مدیران شرکت «اپل» اختصاص داده و بخشی را هم به ذکر نقص‌های یکی از محصولات «اپل» اختصاص دهد که 10 یا 20 سال پیش از رده مصرف خارج شده است
گستردن,دیپلماسی رسمی است که با گستردن بحث های فوری با
پیچاندن,اردوغان که سالهای اخیر با شعارهای شاخه سوری اخوان المسلمین علیه بشار اسد همراه شد و تا حمایت از گروه‌‌های تروریستی از طریق کانال‌های مخفی پیش رفت، به تدریج ترمز می‌گیرد و با پیچاندن فرمان از جاده سیاست آمریکا و عربستان در سوریه به جاده سیاست ایران و روسیه نزدیک می‌شود
