word,sentence
پرکننده,درجه بندی نه برای توسعه سینما، بلکه برای کانالیزه کردن و ترویج یک تفکر و تلقی خاص از سینما بود که با سینمای مخاطب عام و سینمای پرکننده اوقات فراغت متفاوت بود و سینماها را خالی کرد
جادادن,با آن که در آپارتمان‌های کوچک مشکل قرار دادن وسایل اضافه بیش‌تر خود را نشان می‌دهد، با کمی دقت می‌توان از بسیاری از جاهای بی‌استفاده برای جادادن این وسایل دست‌وپاگیر استفاده کرد
بلندکردن,پزشک فیزیوتراپی به شما نحوه صحیح بلندکردن شی،راه رفتن ، و تمریناتی برای استقامت و کشش عضلات پشت ،ساق پا و شکم به شما نشان می دهد
واداشتن,بنابراين به يك تعبير از نظر يوسا رمان خوب رماني ناراضي، عصيانگر و تسليم‌ناپذير است زيرا زندگي روزمره را نمي‌پذيرد اما از طرفي ديگر در تقسيم‌بندي رمان، يوسا مي‌گويد «هر رمان خوب راست مي‌گويد و هر رمان بد دروغ مي‌گويد اما راست و دروغ در اينجا باري اخلاقي ندارد بلكه بالعكس منظور از راستگويي در رمان يعني واداشتن خواننده به زيستن در توهم و دروغگويي به معناي ناتواني در نيل به اين حيله است؛ حاصل كار اينكه رمان دروغ مي‌گويد – كار ديگري ندارد كه بكند – اما اين فقط يك روي سكه است
خواباندن,به یک طرف خواباندن فرد، موجب تسهیل تنفس شده؛ و از خفگی جلوگیری می کند
علفی,یکشنبه 22 شهریور 1394 - 13:15:58 | کد مطلب: 307045 چاپ آشنایی با چند خاصیت باور نکردنی گیاه خردل زندگی > تغذیه - همشهری آنلاین: خردل گیاهی علفی، یک ساله و به ارتفاع ۲۰ تا ۶۰ سانتی‌متر است که دارای کرک‌های خشنی است
دوشیزه,می گوید آشنایی آنها سر ساخت فیلم مصائب دوشیزه اتفاق
ضربی,آواز قاسیموف پس از این پیش‌درآمد آشنا، با یک ضربی ابوعطا آغاز شد و آواز شور روی شعر حکیم فضولی به دنبال آن، از زبان مشترک موسیقی دستگاهی ایران و موسیقی موقامی آذربایجان حکایت داشت
سیرکردن,دلیلش هم ساده‌ بود؛  به نظر می‌رسد آنها خیلی هم اهل دروغ و دغل نباشند، به نظر می‌رسد این  زمستان، آنها را هم آن‌قدر تحت فشار گذاشته که مجبور هستند برای سیرکردن  شکم‌شان، دست جلوی دیگران دراز کنند
خمار,با لُنگ دستش را  تا آرنج بسته و از لای موهای سر و صورتش نمی‌شود تشخیص داد چرت می‌زند یا  خمار است
خمار,مرد با چشم‌های خمار این‌ور و آن‌ور را دید می‌زند: «پس کجاس، چرا نیومد، ساعت چنده؟»
اهنگ,پخش وقتی اهنگ مناسب طبع خود را در apple music
دراوردن,گفتنی است هر سال گرازها با حمله به زمین های کشاورزی و باغات نیکشهر و شهرهای اطراف، خسارت های زیادی به کشاورزان وارد کنند،‌ از جمله از ریشه دراوردن درختان تنومند انبه، مرکبات و درختان خرما
ارام,افرادی که روزانه سه بار به دستشویی می روند از این مورد مستثنی هستند اما اگر کمتر از این به دستشویی مراجعه می کنید حتما دچار مشکلات گوارشی و گوارش ارام هستید به همین علت ممکن است طی چند هفته دچار اضافه وزن شود
واداشتن,html  --------------------------------------------------  عنوان : اینگونه شوهرتان را وادار به بیان احساسش کنید  --------------------------------------------------  برای اکثر زنان واداشتن شوهرشان برای اینکه احساسات درونی خود را با آنها در میان بگذارند، کار مشکلی بنظر می رسد
واداشتن,""" این جمله به گوشتان آشنا است؟  برای اکثر زنان واداشتن شوهرشان برای اینکه احساسات درونی خود را با آنها در میان بگذارند، کار مشکلی بنظر میرسد"
واداشتن,اما رمز و راز واداشتن همسرتان برای بیان احساساتش چیست؟       راز شماره 1 مردان حقیقی از عدم پذیرش وحشت دارند واقعا!   این درست است
کشدار,با نگاه کردن به این لیست می توانید شاخصی برای انتخاب سرعت شاتر در وضعیت های مختلف به خاطر بسپرید و اگر تمایل داشتید تا حرکت سوژه شما به صورت کشدار در تصویر به ثبت برسد با یک یا چند درجه پایین تر می توانید عکسی متفاوت و جذاب بگیرید: فوتبال: 400/1
کشدار,اسفند تعطیل رسمی است ماجرای کشدار تعطیلی 30 اسفند از
جاانداختن,سلطانی‌فر معتقد است در این روش، با تکرار پیام، سعی در القای مقصودی معین و جاانداختن پیامی در ذهن مخاطب دارند؛ «تکرار از لحاظ روانشناسی در تشکیل عادت، بسیار مفید است؛ به‌ویژه اگر با دقت توأم باشد
واداشتن,روز شنبه بيستمين روز اعتصابی است که هدفش واداشتن پرزيدنت هوگو چاوز رئيس جمهوری ونزوئلا به استعفاست
ایین,کد خبر: ۴۳۸۴۴   تاریخ انتشار: ۱۳۹۴/۰۱/۲۵ ورود وزارت کشور به ماجرای حضور زنان در ورزشگاه تدوین ایین نامه حضور بانوان در ورزشگاهها در دست اجراست
ایین,کد خبر: ۴۴۵۳۵   تاریخ انتشار: ۱۳۹۶/۰۱/۱۱ رئیس جمهوری در ایین افتتاح طرح های اقتصادی در سنندج: را برعهده دارد و امیدواریم در راه اهداف بلند الهی
دریده,همین عدم صبوری باعث می شود هر حرفی گفته شود و در نتیجه خیلی از پل ها خراب و پرده ها دریده شود
اهنگ,supports HTML5 video اهنگ مانستر های قشنگه( اپارات احمقی پاک کنی ) يکشنبه ۲۲ مرداد ۱۳۹۶ - ۱۳:۵۱:۰۷ اولین واخرین هالی اوهر در جهان  من اولینم هرکی لج کنه ه - آپارات
سیه,مجددا عرض می شود و با مقایسه دو عکس اصلی و دستکاری شده توسط جاعلان و سیه دلان بخوبی پیداست که درصورت آقای هاشمی هیچ نشانه ای از زخم،خون، یا کبودی وجود ندارد
دریافتن,"پاشا مهدوی، پژوهشگر علوم سیاسی دانشگاه جرج‌تاون واشنگتن به ""زود دویچه"" گفت: «پیش از طرح این اتهام‌ها نیز دریافتن این مسئله ساده بود که بخش بزرگی از این شرکت توسط مدیران دولتی کنترل می‌شود»"
فراش,به والدین سالمند تنها، آگاهی بدهید بسیاری از سالمندان، به‌خصوص بانوان سالمند، به حرمت همسفر از دست رفته، دست از همه چیز می‌شویند و برای همیشه تارک دنیا می‌شوند، گرچه برخی نیز باوجود میل باطنی، بنابر دلایلی، مجبور به پذیرش تنهایی می‌شوند و برای همیشه قید ازدواج را می‌زنند یا با تجدید فراش مخالفت می‌کنند
یکسر,آیا زمانی که انسان می‌میرد، روح او هنگام شست‌وشو و مراسم کفن و دفن،  جسمش و اهل و عیالش را که در تکاپوی تدفین هستند را می‌بیند؟ آیا احساس آنها را درک  می‌کند؟ آگر طبق روایات خواب را برادر مرگ بدانیم، همانگونه که در خواب ارتباط‌مان  با این دنیا قطع می‌شود، آیا مرگ نیز نوعی خواب دراز مدت است؟ یعنی با مردن ارتباط  اموات با این عالم بکلی قطع می‌شود؟ آیا عالم برزخ واقعیت دارد؟ آیا صدقات و خواندن  قرآن برای مردگان سبب آمرزش یا بوجود آمدن خیری برای آنها می‌شود؟ کسی را از چند و چون روح پس از مرگ خبری نیست آنچه از کتب آسمانی به‌خصوص قرآن  می‌توان دریافت این است که خود آگاهی ما با مرگ از بین نمی‌رود بلکه پس از ترک عالم  جسمانی یکسر به نزد پروردگار می‌رویم که جایگاه اصلی ما آنجاست
پیچاندن,"یعنی به قدری ما در این حوزه خوب عمل نکرده ایم که همین سریال هم گرفته است؛ در حالی که سئوال من این است واقعا این سریال چه پیامی دارد؟! غیراز اینکه گاهی اوقات به خاطر کمبود محتوا و پر کردن وقت مردم، با دست خودمان، خودمان را مسخره می کنیم؟!   به گزارش سایت بسیج، وی با اشاره به برخی از شخصیت های حاضر در این سریال از جمله امیر نوری در نقش «فرید چاردانگه» تصریح کرد: یک بچه ریشو را برمی دارند به نام بسیجی، یک آدم ""منگولی"" نشان می دهند که همیشه به دنبال پیچاندن و تک زدن است! بقیه بسیجی‌ها هم آدمهایی احساسی نشان داده می‌شوند که دائما دنبال درگیری‌اند"
گماشتن,وصيت از ريشه وصي و به معناي عهد، فرمان دادن و سفارش كردن است و در اصطلاح حقوقي، وصيت عملي حقوقي است كه به موجب آن، شخص به طور مستقيم يا درنتيجه تسليط (گماشتن) ديگران در اموال يا حقوق خود براي بعد از فوت تصرف مي‌كند
واداشتن,عدنان حاج، عکاس رویتر، به اتهام دستکاری در عکس‌هایش و واداشتن سوژه‌ها به ابراز احساسات از ادامه کار منع شد و تمام عکس‌های ارسال شده وی از آرشیو این آژانس خبری حذف گردید
ترسیدن,پژواک دردناک زندانیان در ساختمان در کنار همه شکنجه های فیزیکی دردناک  این مکان که آن را در زمان خودش از سایر زندان ها متمایز می کرده است شکنجه های روحی و روانی ای وجود داشته که توسط ساواک و شکنجه گرهای آن صورت می گرفته است یکی از عواملی که به انجام شکنجه های روحی و تضعیف روانی این زندان کمک می کرده است نحوه معماری ساختمان زندان بوده است چون  آن را طوری طراحی کرده اند که وقتی شما در آن فریاد بزنید به هیچ وجه صدا و پژواک آن به بیرون ساختمان بروز پیدا نمی کند و همین ویژگی آن هم باعث شده تا کسی سالهای سال از حضور زندان ساواک در دل شهر خبر نداشته باشد؛ اما نکته جالب توجه اینجاست که به همان اندازه که صدای داد و فریاد در این زندان به بیرون نمی رود ولی به همان اندازه صدا و پژواک فریادهای دردناک خود زندانیان در دل زندان می پیچده تا این امر موجب ترسیدن و تضعیف روحیه زندانیان شود
پزو,فورد قراردادش بامکزیک را لغو کرد/ ارزش «پزو» کاهش یافت کد خبر: 50807 - تاریخ انتشار 15 دی 1395  -  16:32 به دنبال لغو برنامه فورد آمریکا مبنی بر ساخت خط مونتاژ خودرو در مکزیک، ارزش «پزو» با روندی نزولی روبرو شد
پزو,۵ درصدی ارزش   «پزو»، پول ملی مکزیک شد
طفیلی,به زنان مؤمنه بگو دیدگان خویش فروخوابانندو دامنهای خویش حفظ کنند و زیور خویش آشکار نکنند مگر آنچه پیداست ، سرپوشهای خویش برگریبانها بزنند ، زیور خویش آشکار نکنند مگر برای شوهران یا پدران یا پدران شوهران یا پسران یا پسرشوهران یا برادران یا برادرزادگان یا خواهرزادگان یا زنان یا مملوکانشان یا مردان طفیلی که حاجت به زن ندارند یا کودکانی که از راز زنان آگاه نیستند ( یا بر کامجویی از زنان توانا نیستند ) و پای به زمین نکوبند که زیورهای مخفی شان دانسته شود
اهنگ,شاید شاید و شاید همه ما برای تم استارت بازی نسخه 2007 که از بین یک دوربین میان تماشاگران در یکی از بازی های لیگ جزیره بود دلمان تنگ شده است و همینطور برای موسیقی های بسیار زیبا که من را وادار به جستجو در اینترنت و دانلود تمامی اهنگ های نسخه 2007 فیفا کرد
ارام,چگونه سیری رو در طول مرحله Blood on the Battlefield ارام کنید 2
ارام,"در طی مرحله BLOOD ON THE BATTLE FIELD برای ارام کردن سیری بهش بگید Relax, you don’t have to be good at everything"
ارام,در طی مرحله BLOOD ON BATTLEFIELD برای ارام کردن سیری بهش بگید I know what might lift your spirits
ارام,در طی مرحله BLOOD ON BATTLEFIELD برای ارام کردن سیری بهش بگید I know what might lift your spirits
دوشیزه,که عقد کرده و دوشیزه هستند حذف می شود حمید
جاافتاده,دارو از برندهای جاافتاده از فهرست بیمه است ارسال شده
جاافتادن,منصوریان اعتقاد دارد با درخشش جپاروف و جاافتادن او در ترکیب اصلی، همچنین رسیدن هشت شاکی استقلالی‌ها به فرم مطلوب بدنی که قدم به قدم در حال طی شدن است، ترکیب میانی این تیم برای حریفان غیرقابل مهار خواهد شد
ایین,بر اساس آخرین آمارهای بانک مرکزی رقم مطالبات معوق بانکی به ۹۰ هزار میلیارد تومان می رسد (گرچه آمارهای دیگری هم در این زمینه وجود دارد) و بر این اساس ۳۰هزار میلیارد تومان از ایین مطالبات در اختیار بدهکاران دانه‌درشت بانکی است
ترسیدن,Panophobia در اصل‌ ترس از همه چیز است‌، از بلندی‌، فضاهای بسته‌، حشرات ‌، رنگ‌های روشن‌، آسانسور و حتی آفتاب! این بیماری ترسیدن دائم است، بدون دانستن این که چه چیز باعث آن می‌شود
اهنگ,مشاهده آلبوم آهنگ در حال پخش وقتی اهنگ مناسب طبع خود را در Apple Music پیدا می‌کنید، به احتمال قطع به یقین، مشتاق شنیدن آهنگ‌های بیشتری از آن آلبوم هستید
اهنگ,ایستگاه رادیویی اختصاصی خود را بسازید یکی از قابلیت‌های Apple Music  این است که می‌تواند ترکیبی از موسیقی‌ها را براساس خواننده، آلبوم یا اهنگ اجرا کند
گماشتن,را به وجود آورده که دولت با گماشتن سرپرست در
طفیلی,شهادت تاریخ انقلاب -میزبانان « طیف طفیلی نفوذ» خواهند بود
تاباندن,دكتر رمضاني مي‌گويد ايجاد عادت‌هاي ثانويه مثل تاباندن موي سر و كندن موي صورت و جويدن لب از جمله اين عوارض است
سیه,[۵]  مقام معظم رهبری: «هر ملتى و کشورى در طول زندگانى ممتد خویش،  دوران‌هایى و حوادثى را مى‌گذراند که تأثیر آن در سرنوشت تاریخى او، بسى تعیین  کننده و ماندگار است و مى‌تواند او را به نیک بختى و عزت و اقتدار، یا سیه روزى و  ذلت و حقارت بکشاند
واداشتن,آن‌چه زبان-رژيم را به شدن وامي‌دارد، در بطنِ خودِ آن نهفته است: متوني كه براي ترجمه انتخاب مي‌كنيم، نشانه‌هايي براي واداشتنِ زبان به انديشيدن‌اند، تلنگرهايي براي بيداركردنِ «حافظه‌ي نابِ زبان
خمار,دو بار خفتم کردند، با چاقو تهدیدم کردن،‌ مردای معتاد وقتی نشئه می‌شن همه کار می‌کردند اما وقتی خمار بودند حتی اگه می‌زدی تو سرشون نمی‌پرسیدن چرا زدی؟»
تمثیل,"com/Feed""></script> خبرهای تمثیل آقای فضای مجازی پای چه اختلافات جدیدی را به دنیای حقیقی خانواده‌ها باز کرده است؟   شبکه ایران   ۱۳۹۶/۴/۲۵ ایران آنلاین /یک کتاب رویه قضایی برداشتم تا بتوانم کیس‌های جالب مورد نظر را پیدا کنم اما تقریباً نود درصد پرونده‌هایی بودند با موضوعات تکراری"
گند,کد خبر: ۴۱۵۵۵   تاریخ انتشار: ۱۳۹۶/۰۴/۲۵ سپتیسمی گند خونی یا مسمومیت خون یک مشکل مرگبار می
جاافتاده,«فرم»، البته نه به آن معناي جاافتاده‌اش به مثابه نوعي شمايل، هرگز نمادين نمي‌شود؛ فرم، صف‌آرايي انرژي‌هاي شعري است، چيزي است غيرنمادين و دقيقا مفهوم شعر را در همين سرپيچي از ورود به عرصه نمادين، حد‌گذاري مي‌كند
اهنگ,", کارتون انگلیسی کودکان , ترانه کودکانه دانلود , انیمیشن 2017 جدید خارجی ایرانی باب اسفنجی دانلود آپارات کودک برنامه موبایل اندروید کودک بازی دخترانه دانلود برنامه کودک نوجوان باربیدانلود کارتوندانلود قصهدانلود اهنگ کودکانهدانلود شعر کودکانهدانلود قصه برای کودکان دانلود"
اهنگ,"کارتون انگلیسی کودکان - ترانه کودکانه دانلود- انیمیشن 2017 جدید خارجی ایرانی باب اسفنجی دانلود آپارات کودک برنامه موبایل اندروید کودک بازی دخترانه دانلود برنامه کودک نوجوان باربی,دانلود کارتون,دانلود قصه,دانلود اهنگ کودکانه,دانلود شعر کودکانه,دانلود قصه برای کودکان, دانلود برنامه بی بی انیشتین شبکه پویا کارتون قدیمی دهه 60 -"
گند,لحظاتی در مصاحبه بود که فکر می کردم گند زدم
صادرکردن,کد خبر: ۲۷۷۳۰۸   تاریخ انتشار: ۱۳۹۶/۰۵/۱۳ گفت و گو باشهيندخت مولاوردي: به صورت عملی شروع کردیم به بیانیه صادرکردن مصاحبه کردن
کشدار,ثانیا همان طور که می‌دانید عناوینی مانند «امنیت»، «مصالح ملی» و «مصلحت نظام» مفاهیمی کشدار و قابل تأویل به چندین وجه هستند و اگر این شورا که وظیفه آن صرفا تعیین سیاستهای دفاعی – امنیتی کشور و هماهنگ کردن دستگاه‌های مختلف در مسیر این سیاستها  و رصد نمودن امنیت داخلی و خارجی کشور است، ‌با تمسک  به این مفاهیم افرادی را غیاباً و بدون تفهیم اتهام و شنیدن دفاعیات آنها به حبس‌های طولانی مدت و مانند آن محکوم کند، این امر یعنی زیر پا نهادن دستاوردهای انقلاب اسلامی در حوزه حقوق ملت که در قانون اساسی تبلور یافته است
اهنگ,"مشاوره برای خرید MP3 Plaey 0 بار در 0 پست از وی تشکر شده دستاورد ها: مشاوره برای خرید MP3 Plaey با عرض سلام نمیدونم چرا تو تایپک دیگه هیچی نیست مجبور شدم دوباره تایپک بزنمشرمندهمیخواستم یه MP3 Plaey واسه تو باشگاهتا رنج 170/00مهمترین مزایا1 کیفیت پخش بالا خیلی مهمهاندازه مناسبعمر باطری زیاداین دو مدل دیدم بازم شما پیشنهاد بدبد یه هدفون تا 100 تومن هم میخوام که کیفیت صدای خوبو مهمتر راحت بودن منظورم اینه که وقتی زیاد اهنگ گوش بدم گوشم درد نگیره راحت باشه ممنونم کاربر فعال بخش مشاوره کامپیوتر تاریخ عضویت 27,759 بار در 7,745 پست از وی تشکر شده دستاورد ها: جایزه ها: نوشته اصلی توسط tnhatarin با عرض سلام نمیدونم چرا تو تایپک دیگه هیچی نیست مجبور شدم دوباره تایپک بزنمشرمندهمیخواستم یه MP3 Plaey واسه تو باشگاهتا رنج 170/00مهمترین مزایا1 کیفیت پخش بالا خیلی مهمهاندازه مناسبعمر باطری زیاداین دو مدل دیدم بازم شما پیشنهاد بدبد http://www"
اهنگ,ونراستی یه هدفون تا 100 تومن هم میخوام که کیفیت صدای خوبو مهمتر راحت بودن منظورم اینه که وقتی زیاد اهنگ گوش بدم گوشم درد نگیره راحت باشه ممنونم سلام محمد آقا  عزیز ! به فروم سخت افزار خوش آمدید ! همون تاپیک قبلیتون رو هم من تأیید کردم  ولی نمیدونم چرا دوباره رفته بود به حالت تأیید ؟!! به هر حال اون تاپیک رو من  حذف کردم   و مشاوره رو همین جا با حضور اساتید ادامه بدید ! در کل از قندشکن  و نرم افزارهای دور زدن فی*لتر در هنگام ارسال پست نباید استفاده کنید تا پست و تاپیکهاتون مستقیم به نمایش در بیاد و به حالت تأیید نره ! اگه هم این مشکل به هر علتی به وجود اومد به یکی از مدیران انجمن پیام بدید تا بررسی کنند و پستتون رو تأید کنند ! چون محاله پستی شما ارسال کنید و ارسال نشه ! همه پست ها و تاپیک ها  ارسال میشن  ولی  اگه پست  و تاپیکی به حالت تأید بره فقط توسط مدیران قابل مشاهده و تأیید هست ! پس اگه پستی رو زدید و بعد از ارسال مشاهده نکردید لطفاً پست تکراری نزنید و به مدیران اطلاع بدید تا براتون تأییدش کنند !
تمثیل,"com/Feed""></script> خبرهای تمثیل جالب فضای فضای مجازی پای چه اختلافات جدیدی را به دنیای حقیقی خانواده‌ها باز کرده است؟   شبکه ایران   ۱۳۹۶/۴/۲۵ ایران آنلاین /یک کتاب رویه قضایی برداشتم تا بتوانم کیس‌های جالب مورد نظر را پیدا کنم اما تقریباً نود درصد پرونده‌هایی بودند با موضوعات تکراری"
