word,sentence
فراش,مجلس کویت برای پایان بخشیدن به آنچه 'بحران زنان مجرد' نامیده شده در سال های قبل پیشنهادی را ارائه داده بود که بر اساس آن، دولت کویت مکلف می شد به کسانی که تجدید فراش کنند مبلغ ۱۵۰۰۰ دلار جایزه پرداخت کند
دورکردن,کد خبر: ۷۰۹۶۶۴   تاریخ انتشار: ۱۳۹۵/۱۲/۱۲ بازی خطرناک ترامپ با روسیه و ایران در خاورمیانه/تلاش برای دورکردن مسکو از تهران اند اما واقعیت آن است که اتحادی استراتژیک میان ایران
خز,"پدر فروید برای آن که به پسر جوان خود نشان دهد که اوضاع یهودیان در وین تا چه حد بهبود یافته، واقعه ای را که در مورد خودش روی داده، برای او تعریف می کند:  ""او گفت:""وقتی جوان بودم، یک روز شنبه رفتم تا در خیابان های زادگاه تو قدم بزنم؛ لباس خوبی پوشیده بودم و کلاه خز نو بر سر داشتم"
ایجادکردن,تبلیغ‌کردن و فضا ایجادکردن و موج‌آفرینی برای  ریاست‌جمهوری، پیچیدگی‌های فراوان مجلس را ندارد
سیه,چابهار رفته ایم جوانک سیه چرده اى راننده ماست که
امدن,وی با بیان اینکه اهداف و راهبردهای اوباما و ترامپ یکی است اظهار داشت: اینها در روشها، تاکتیکها و شل و سفت کردنها و کمرنگ و پررنگ کردن انها متفاوت هستند که البته ما امیدواریم با روی کار امدن با اهداف اعلامی وی به تضعیف رژیم صهیونیستی و کمرنگ شدن این ارتباط و امریکا بیانجامد البته نگرانی ما این است که سیاستهای اعلامی ترامپ یک چیز باشد ولی سیاستهای اعلامی اش یک چیز ولی سیاستهای اعمالی اش یک چیز دیگر یعنی خلاف مواضعی که اعلام کرده اند نحوه اعمال سیاستهایشان به شکل دیگری باشد و جنگ زرگری راه بیفتد
ایین,نسخه قابل چاپ چهارشنبه ۱۲ اسفند ۱۳۹۴ - ۱۴:۵۳:۰۰ به گزارش پایگاه خبری« عصربازار »، حامد مظاهریان در گفتگو با خبرگزاری صداو سیما گفت:ایین‌نامه لیزینگ مسکن در بانک مرکزی نوشته شده و در صف تصویب شورای پول و اعتبار قرار گرفته است و اردیهشت ماه در شورای عالی پول و اعتبار تصمیم گیری می شود
گستردن,بزرگراهی که به منزله گستردن فرش قرمز برای خودروهای شخصی
اهنگ,"سایر عوامل سریال ""دور دست ها"" عبارت اند از:  مدیرتصویر برداری: فریدون شیردل، تصویربردار: محمد نورانی، صدابردار: داوود قلی پور، مدیر برنامه ریزی: روح اله ظریف، دستیاران کارگردان: میثم نجفی، مجتبی صدیقی، نوشین لکزی، مدیر تولید: مجید نصیری، تدوین: علیرضا کمال پور، اهنگ ساز: پیروز ارجمند، طراح صحنه:  حسن علیزاده فرد، طراح لباس: فریبا بانک توکلی، طراح گریم: فرانک گلنوش، عکاس و کارگردان پشت صحنه: وحید پیماندار"
افسونگر,بدون نظر ۲۲ دی ۱۳۹۵ - ۱۴:۴۱ آنونس فیلم سینمایی«افسونگر»؛تماشا کنید آنونس فیلم سینمایی«افسونگر» با نام قبلی «مدعی» را به نویسندگی و کارگردانی حسین تبریزی و تهیه کنندگی مسعود اطیابی تماشا کنید
افسونگر,در خلاصه داستان «افسونگر» آمده است: روایت انسان و انسان-اعمال و کردار-رویارویی خویش با خویشتن-یافتن خود از بیخودی و گذشتن از ناحق به حق-بودن برای زیستن-زیستن برای عشق
افسونگر,در «افسونگر» پژمان بازغی، لیلا اوتادی، نیلوفر شهیدی،… ادامه
طفیلی,اما کشورهای جهان سومی چون عقب مانده اند، فکر میکنند اقتصاد و سیاست مهم است، چون ابزار پیشرفت است و فرهنگ را باید از طفیلی اقتصاد و سیاست بدانند و ریزه… ادامه
فراش,مادر او را دید که در کنار فراش او نشتسته و گریه‌زاری و جزع می‌کند
گند,اینجا هنوز بوی گند بنیتس را می دهد ژوزه مورینیو، در اولین مصاحبه خود پس از پیوستن به چلسی، شمشیر را از رو بست و به شدت به پپ گواردیولا، رافائل بنیتس و سر الکس فرگوسن حمله کرد
دریده,گذاشت روستاییان پسر بچه را با شکم دریده ریه و
سیه,خودش که حرف نمی‌زند، اما پیرمردی سیه‌چرده اطلاعاتی در مورد حاج حسین می‌دهد: وسایلی که هیچ‌‌کس نمی‌تواند درست‌شان کند، او درست می‌کند
پسندیدن,مشتریان ، همراه بانک جدید صادرات را پسندیدن حمید طلیمی بدون دیدگاه تصویر روز: با توجه به ارایه همراه بانک با قابلیت کاربرد اثر انگشت، شمار فراوانی از مشتریان بانک صادرات ایران را که از دستگاه های دارای سیستم عامل Ios استفاده می کنند از کاربران این خدمات پیشرفته بانک قرار داد
درخشیدن,در نتیجه بازیگران به‌ویژه معادی و جواهریان‌، مانند نهنگ‌های بزرگی هستند که قرار است در یک حوض کم‌عمق شنا کنند‌! معادی که آشکارا برای درخشیدن بی‌قرار است‌، فرصتی برای بروز دادن توانایی خود در لحظه‌های عصبیت عاشقانه پیدا نمی‌کند و در نتیجه در نماهایی بی‌ربط‌، رو به بازی اغراق‌آمیز و بیرونی می‌آورد تا عصیان درونی شخصیت را بیرونی کند
نگاشتن,حال این پرسش مطرح است که نگاشتن یک نامه اداری- حقوقی چند روز زمان می‌برد؟ مگر قرار است در این نامه چه مسائلی گنجانده شود که اداره کل میراث فرهنگی استان تهران را یارای نگارش این نامه نبوده است؟! از سویی چرا مسوولان میراث تهران روز شنبه(۲۹ خرداد) عنوان می‌کنند که نیروی یگان به محل اعزام شده و روز سه شنبه اظهار می‌کنند در شُرُف ارسال نیروی یگان به محل هستیم؟! این در حالی است که صبح روز یکشنبه(۳۰ خرداد) در همایش تجلیل از حافظان میراث رجبعلی خسروآبادی – مدیرکل میراث فرهنگی استان تهران- با اشاره به این که میراث فرهنگی یک سرمایه ملی تجدید ناپذیر است، می گوید: سیاست پیشگیرانه و فرهنگ سازی عمومی در صیانت و نگهداری از میراث فرهنگی بسیار راهگشاتر از برخوردهای قهری است
علفی,نکته دوم آن است که محصولات غیر چوبی که از پیکره علفی و خشبی می‌آید جزء حقوق مردم است و نمی‌توان برای آن بهره مالکانه تعیین کرد تا از برداشت این محصولات درآمدی برای مدیریت جنگل کسب شود
جداشدن,از سوی دیگر،تماشاگر مطلع با فقدان موضوعاتی چون؛عدم پرداخت ریشه یابی نام کشور عراق،ریشه لغوی بغداد،خرابه های تیسفون و طاق کسری (خسرو)،تحولات عثمانی و نحوه جداشدن عراق از عثمانی و ترکیه امروز،عدم توجه معنادار  به حضور بنیانگزار انقلاب در عراق،چرایی جنگ ۱۶ کشور در کنار عراق علیه ایران،چرایی حمله موشکی صدام به اسراییل پیش از اتمام حمله امریکا و اشغال بغداد و دلیل برزبان آوردن جملات ؛مرگ بر اسراییل ،مرگ بر ایرانی آتش پرست و زنده باد فلسطین توسط صدام حسین،نمی تواند به استنادهای این مستند پر زرق و برق،دلخوش کند
تاباندن,حال لازم است هنرمندی آن‌را به‌وجهی کمال‌یافته تبدیل به تصویر کند برای تاباندن بر پرده و ذهن تماشا کند
جداشدن,دلیل ترس نسبت به جداشدن از تلفن همراه   آفتاب نیوز   ۳۱ دقیقه پیش آفتاب‌‌نیوز : اینکه یک کاربر برای هشت ساعت طی یک روز، به نمایشگر کوچک دستگاه تلفن همراه خود خیره شود امروزه امری عجیب نیست
درخشیدن,این مدرس فلسفه اسلامی ادامه داد: اگر قابلیت های دینی و هنری جوانان مستعد و توانای هر محله از سوی استادان این جشنواره با نگاهی کیفی شناسایی شوند و زمینه های رشد و درخشیدن این افراد در جهت خلق شایستگی های برتر فراهم گردد بدون شک در میان نسل های جوان آن منطقه نیز اثرات به جایی خواهد داشت؛ چرا که ایمان، اخلاق دینی، معنویت و تقوا به مثابه آتش است و هر چیزی که در کنار آتش قرار گیرد به آن نیز سرایت خواهد کرد
اوردن,مور می گوید:«اگر شما نمی توانید خوب زندگی را پیش ببرید ،بچه اوردن به نیت بهبود روابط ممکن است کوبیدن آخرین میخ بر تابوت زندگیتان باشد وبا بر انگیختن حسادت همسرتان احساسات او را بکشید
ساییدن,این پلاک ها اگر از روی دندان پاک نشوند روی آن تجمع کرده و شروع به ساییدن مینای دندان می کنند
دریافتن,اپل Music البته شباهت‌هایی به سرویس موسیقی قبلی اپل هم دارد برای دریافتن تفاوت آنها پرسش و پاسخ‌های زیر را بخوانید :  اپل Music چیست ؟ اپل موزیک یک سرویس موسیقی است که به شما اجازه می‌دهد به هر موسیقی روی آی‌تیونز گوش دهید
فتوکپی,معاون شهردار منطقه یک گفت: افراد کم سواد و بی سواد با ارائه فتوکپی و تصویر شناسنامه ،کپی کارت ملی و … به سرای محلات مراجعه کرده و ضمن معرفی خود، با روند آموزش‌ها آشنا می‌شوند
جاگذاشتن,هفته هشتم مرحله دوم مقدماتی جام جهانی، دوشنبه 22/03/96، ساعت 21:15، ورزشگاه آزادی   داور: احمد ابوبکر(عمان)                کمک ها: حامد سلیمان، ابوبکر سلیم(عمان)   تیم ملی ایران:  علیرضا بیرانوند، سید جلال حسینی، مرتضی پورعلی‌گنجی، رامین رضاییان، میلاد محمدی، سعید عزت‌اللهی، علی کریمی، علیرضا جهانبخش(2+45 وحید امیری)، مهدی طارمی(90 رضا قوچان نژاد)، مسعود شجاعی(69 اشکان دژاگه) و سردار آزمون سرمربی: کارلوس کی روش    تیم ملی ازبکستان:  لوبانوف، کریمتس، شوراخمدوف، اسماعیلف، آندرف(7 داورونبک خاشیموف)، آفونین(53 سردار رشیدوف)، حیدروف، اخمدوف، شمورودوف، سرگیف و عبدولخولیکوف(62 جلال الدین ماشاریپوف) سرمربی: ساموئل بابایان آفونین(28) - خاسیموف(3+90) از ازبکستان سردار آزمون (76) از ایران   شرح گل ها ایران 1 ازبکستان 0 (دقیقه 23، سردار آزمون): در حالی که بازی در میانه میدان در حال انجام بود حمله غافلگیرانه ملی پوشان ایران دروازه ازبکستان را باز کرد، پاس دیدنی علیرضا جهانبخش در موقعیت فوق العاده ای به آزمون رسید و سردار نیز پس از جاگذاشتن مدافع ازبکستانی به محوطه جریمه رسید و موفق شد با ضربه ای دقیق دینی دروازه لوبانوف را باز کند
فتوکپی,-  تجهیزت اداری مانند پرینترها و ماشین‌های فتوکپی
جداکردن,ها و مقدمه جداکردن هرات از پیکر ایران 23 ژانویه
فراگرفتن,وی  با بیان اینکه این هتل به دلیل اشتعال نماهای کامپوزیت دچار آتش سوزی شده  است، گفت: دلیل آتش سوزی پروژه هایی که از نمای کامپوزیت آلومینیم استفاده  می کنند بیشتر به دلیل عوامل کارگاهی یا عدم فراگرفتن مهارت های کافی در  این زمینه است
سیه,منشا: نمیتوانم موهایم را به سنت شما اصلاح کنم روز نو : مهاجم سیه‌چرده پرسپولیس که این روز‌ها حسابی خبرساز شده است قصدی مبنی بر ایجاد تغییر در وضع ظاهری‌اش ندارد
جداکردن,در ادامه عملیات آواربرداری در قسمت جنوب غربی ساختمان پلاسکو، آتش‌نشانان از ساعتی قبل به منظور جلوگیری از ورود خسارت به ساختمان مجاور، اقدام به برش ستون این بخش از ساختمان به شیوه هوابرشی کرده و سرانجام دقایقی بعد با استفاده از جرثقیل اقدام به جداکردن این بخش کردند
سیه,زیبایی‌شناسی وقتی او را از بیابان آوردند دید یک زن عادی‌ سیه‌چرده است: به مجنون گفت روزی عیبجویی که پیدا کن به از لیلا نکویی که لیلا گرچه در چشم تو حوری است به هر عضوی از اعضایش قصوری است چو مجنون این سخن بشنید آشفت در آن آشفتگی خندان شد و گفت تو مو بینی و مجنون پیچش مو تو ابرو او اشارت‌های ابرو اگر در کاسه چشمم نشینی به جز از خوبی لیلا نبینی از این جهت برخی گفته‌اند برخلاف آنچه انسان‌ها خیال می‌کنند که زیبایی عشق می‌آفریند،‌این عشق است که زیبایی را می‌آفریند
جداکردن,نکتة مهم این است که استاد بینش فلسفی را در تحلیل تاریخ عاشورا بکار برد و در تحلیل حوادث به دنبال یافتن علل و شرایط و جداکردن آنها از یکدیگر بود
مسیله,معمولا جنس اکثر کاندومها لاتکس است که جنس ارجح و مرغوب میباشد با اینحال در بازار انواع دیگری از کاندوم هم وجود دارد که بهتر است مصرف کنندگان نسبت به این مسیله هوشیاری لازم را داشته باشند
خمار,محل تجاوز خمار افتاده بود و توجهی به فریادهای همسرش
سنجیدن,بار اصلی در سنجیدن وضعیت هواپیماها در این فرایند بر عهده رادار تقرب فرودگاهی است که یکی از اصلی‌ترین سامانه‌های فرودگاهی به شمار می‌رود
ساییدن,در هنگام کنده شدن موتور، ملخ آن از کابین گذشته و با عبور از کنار شانه عتیقه چی ضمن ساییدن به شانه او، برای آخرین بار به زمین برخورد کرد و از حرکت ایستاد
ساییدن,روش جدید شامل شست‌وشو و خشک کردن نمونه مو، ساییدن با یک پودر، حرارت دادن پودر و سپس استفاده از طیف‌سنجی انتشار نوری برای آنالیز بخار است
واداشتن,"به گزارش پایگاه خبری شبکه العالم ، روزنامه انگلیسی "" دیلی استار ساندی"" به نقل از عمر حسین، داعشی انگلیسی ملقب به ابو سعید انگلیسی، نوشت: «بسیاری از کودکان این روزها از دیدن گاوی که سربریده می شود، هراس دارند؛ ولی ما با واداشتن کودکان به کشتن گروگان ها کاری می کینم که آن ها از جنگ نترسند و ترسو تربیت نشوند»"
بلندکردن,ربات قدیمی ناسا با 104 کیلوگرم وزن می‌تواند 35 حرکت اصلی مثل راه‌رفتن، چرخاندن دست‌ها، بلندکردن پاها و تکان دادن دست‌ها را تقلید کند
تاباندن,این نکته ای است که روزنامه نگاران که این روزها به مناسبت روز خبرنگار مورد توجه مسئولان بخش های مختلف حاکمیت قرار می گیرند، زودتر از دیگران متوجه آن می شوند و همواره در خط مقدم دفاع از آزادی قرار دارند زیرا به این باورند که وجود آزادی بیان نه تنها تضمین کننده استمرار دموکراسی و آزادی شهروندان است بلکه از بسیاری از فسادهایی که به سبب تمرکز قدرت در دست بخش هایی از قدرتمندان به وجود می آید، از جمله فساد اداری، فساد مالی و اقتصادی و فساد سیاسی جلوگیری می کند، زیرا این فسادها در محیط های بسته و تاریک رشد می کند و کار رسانه و روزنامه نگار نور تاباندن بر این محیط های تاریک است
خز,اينايي كه ميرن كلاس گيتار ، بدون استثنا اولين آهنگي كه ياد ميگيرن آهنگ خز شده و ضايعِ “اگه يه روز بري سفر” ميباشد پ
گند,پسره به هزار اميد از نامزدش مي پرسه از كجا بدونم منو واسه خودم دوست داري؟ برگشته ميگه: قيافه و هيكل كه نداري بچه مايه دارم كه نيستي اخلاقتم كه گند دماغه به جز خودت چيزي واسه دوست داشتن نمي مونه عزيز دلم !!
جداشدن,زيرا نخستين مكان جدي كه كودك پس از جداشدن از خانه و خانواده به آن وارد شده و حضور در فضاي جديد را تجربه مي كند، همين دوره است
فراش,مي‌گويد به فراش مدرسه گفته تا تمام كاغذهاي تبليغاتي را كه شبانه به ديوارها چسبانده‌اند برايش بياورد تا او ريزريزشان كند
جابهجا,رانت میلیاردی که در صنعت پتروشیمی جابهجا می‌شود باعث شده تا به زودی با سوال از وزیر صنعت دلیل اصرار وی برای خروج محصولات پتروشیمی از بورس کالا در صحن علنی مجلس را جویا باشیم
حنبلی,او فقه مذهب حنبلی را از پدرش فرا گرفت
حنبلی,گرچه شیخ محمد ادعای پیروی از مذهب حنبلی را داشت و خود را به این مذهب نسبت می‌داد، اما علمای مذهب حنبلی این ادعا را بشدت رد می‌کردند و کتاب‌های زیادی را بر ضد او نوشتند
ابادان,در این دیدار نایب قهرمان فصل گذشته لیگ برتر پالایش نفت ابادان موفق شد گام نخست را محکم برداشته و با حساب 88بر67 به پیروزی برسد
جاافتاده,او با اشاره به نظریه مدیریتی در مقوله امنیت اجتماعی ادامه می‌دهد: بر این اساس،  مدیریت جامع شهری و آیین شهروندی باید به صورت جاافتاده و منطقی وجود داشته باشد؛ آپارتمان نشینی،  رانندگی و سبک زندگی، باید طبق نظامی مشخص و هم گون با توسعه جامعه باشند و اگر جامعه در بخش مردم و مدیریت دچار شکاف شود و یا مدیریت صحیحی در پشت امور شهری دیده نشود، زمینه برای هرگونه وقوع جرم فراهم خواهدشد
فتوکپی,کد خبر: ۴۲۶۵۶   تاریخ انتشار: ۱۳۹۶/۰۵/۱۶ دستگاه های فتوکپی و اسکنرها طوری برنامه ریزی شده اند
تمثیل,ایراد سخن در حد فهم مخاطب، مخاطب‌شناسی و استفاده از همه صفات در ابلاغ کلام و پیام و به کارگیری اشاره و ایهام و تمثیل و تشبیه و محکم و متشابه و همه اینها درس‌های ارزشمند مکتب انبیاء الهی است
دورکردن,مع‌الوصف، کاستی‌های امروز اعم از خبررسانی‌های تفرقه‌انگیز و یا ناظر به تحقیر انسان‌ها اعم از گروه‌ها و اقشار منتسب به یک آیین یا نژاد یا منطقه جغرافیایی و یا رنگ پوست، دورکردن مردم از واقعیت‌ها، کوچک و بزرگ جلوه دادن واقعیت‌ها، عبور از بعضی واقعیت‌ها و پرداختن به بعضی دیگر به مقتضای منافع شخصی و گروهی و منفعت‌طلبی و قلب واقعیت‌ها در خبر و گزارش همه ناشی از دوری و یا بی‌توجهی به تعلیمات الهی است
جاافتاده,می‌توانید خودتان هم ویژگی‌هایی را که به نظرتان مهم است و جاافتاده‌اند، به این فهرست اضافه کنید
ترسیدن,احساس خطر و ترسیدن در بعضی از موقعیت‌های زندگی باعث دوام و بقای‌ ما می‌شود
ایین,وزیر آموزش و پرورش با بیان ایین نکته که متأسفانه در ساختار نظام جدید آموزش و پرورش به جای اینکه به ارکان و اجزای یاد شده بپردازیم، گفت: از جهت ساختار به آن وارد شدیم یعنی گفتیم مقطع ابتدایی به جای 5 سال 6 سال باشد
سیه,عباس جدیدی در پیکارهای وزن 90 کیلوگرم رقابت های سال 1993 جهان در تورنتو کانادا با شکست ماخاربک خادراتسف آزادکار سرشناس روس (دارنده دو مدال طلای المپیک و 5 قهرمانی جهان) به دیدار فینال راه یافت و در دیدار فینال نیز «ملوین داگلاس» کشتی گیر قدرتمند و سیه چرده آمریکایی را از پیش رو برداشت
خمار,کد خبر: ۱۶۴۷۵۸   تاریخ انتشار: ۱۳۹۶/۰۳/۲۵ توهین بازیگر سینما به یک خبرنگار: آقای خمار! انگار یک چیزی بالا انداختی یکی از خبرنگاران به جعفری گفت شما هنرمندان گویا نمی
خواباندن,و شرکت آمریکایی مک دونالد برای خواباندن انتقادها گوجه فرنگی
جاافتاده,"کمی این‌طرف‌تر اما مردی جاافتاده می‌خواهد جلو برود تذکر  بدهد اما می‌ترسد که یکی از شهروندان به او معترض شود و بگوید ""آقا، به تو  چه ارتباطی دارد؟"" و کسی چه می‌داند شاید قمه‌ای زیر آستینی مخفی باشد تا  گلوی وی را بشکافد و فردا تیتر روزنامه‌ها بشود که آمر به معروف بر اثر  اصابت ضربات قمه جان خود را از دست داد"
تاباندن,بخاطر اينکه ابرسيال کوانتومي آنها خيلي ساده با    تاباندن باريکه‌هاي ليزري روي اين افزاره ساخته مي‌شود، مي‌تواند منجر به    ساخت آشکارسازهاي عملي فوق‌حساس شود
