word,sentence
کیفور,ولی بعضی وقت ها، وقتی بازیگران سرحال باشند و کارگردان کیفور
کشدار,قصد دارم آگاهانه از آوردن عبارات کشدار و نیشدار بپرهیزم
علفی,وی افزود: عده ای که خود را برای معنویت آماده کردند از سوی برخی افراد به آن ها گفته می شود دست از معنویت بردارید و هر علفی که دوست دارید در آخور خوبی برایتان آماده کرده ایم؛ این افراد همین موضوع را نیز دروغ می گویند اما اگر راست هم باشد هدف انسانیت بود
دریده,نوع دریده شدن دام ها باعث شد اسم هیولای جگرخوار
دریده,که به طرز عجیبی دریده شده بودند می گذرد لاشه
دریده,دریده شدن دام ها باعث شد اسم هیولای جگرخوار را
دریده,افتد و با توجه به نحوه دریده شدن دام ها
فتوکپی,زیراکس از شرکت‌ های پیشرو جهان در بخش مدیریت اسناد است که در زمینه  تولید و فروش پرینترهای رنگی و سیاه‌ و سفید، سیستم‌ های چند منظوره،  دستگاه‌ های فتوکپی، تولید دستگاه‌ های چاپ دیجیتال و سایر خدمات مربوط به  این حوزه فعالیت دارد
سیه,چه وقتی که در پروجا بازی می‌کرد و چه زمانی که در تیم  سیه‌نا بود
تمثیل,این مجسمه ، تمثیل زنی به نام تائیس است که گفته میشود معشوقه اسکندر است و البته برای ما ایرانی ها نماد آزادی نمیتواند باشد چون میگویند اسکندر به ترغیب او تخت جمشید را آتش زده است
سیه,»، «در کل این ماجرای # فیش - حقوقی  اتفاق میمونی است چون یک سری افشاگری به همراه داره از هر دو طرف؛ در  نتیجه سیه روی شود؛ هرکه در او غش باشد»، «   مضحک‌ترین استدلال  اینه که با حقوق نجومی به مدیران دولتی باج بدیم که دزدی نکنن
سنگچین,همینطور سنگچین‌ها، چاه‌ها، سنگ‌فرش‌ها و غارهایی شبیه آتشگاه در دل کوه‌ها بجا مانده‌است
خواباندن,صندلی​های ردیف دوم نيز قابل خواباندن هستند تا در مواقع نیاز فضای بسیار بزرگ براي حمل بار فراهم شود و مهندسي کم نقص برند خودرو را به شما يادآوري کنند
جاافتاده,هر رییس جمهوری فکر می کنم برای پی گیری اهدافش نیازمند این است که یک نفر را برای پی گیری منویات اصلی اش تعیین کند، مسولیت معاونت اجرایی یک مسولیت جاافتاده ای در نظام جمهوری اسلامی است
درباز,نقش رسانه ها را در برطرف کردن نقصان ها چه می دانید؟ این که گاهی اوقات آدم در برخی از جشنواره ها یا نمایشگاههای مطبوعات و کتاب وارد می شود عناوینی را نمی بیند و از آن متاثر می شود و دلش می خواهد این عناوین همیشه باشد و هیچ گاه حذف نشوند، با همه این فراز و فرودها اما فکر می کنم که ما یک روند رو به رشدی را درباز کردن فضای سیاسی و اجتماعی در کشورمان داریم مشاهده می کنیم
جداشدن,5 سانتی‌متر در سال در حال جداشدن از هم هستند
تمثیل,در اینجا شاید ذکر یک نکته ضروری باشد و آن اینکه احتمالا در جملات فوق از یک حقیقت با زبانِ به اصطلاح تمثیل خبر داده شده است
جاافتاده,در این نقد تاکید شده بود امیرحسین رستمی مثل یک فوتبالیست جاافتاده و  باهوش است که می‌داند در چه فرصت‌هایی باشد یا درچه موقعیت‌هایی نباشد؛ او  مثل کاپیتان عمل می‌کند
جداشدن,۴- اختلافات سیاسى واجتماعى، تبعیض‏ها، کمبودها، بداخلاقى‏هاى سیاسى، گرانى و خیلى از مشکلات اقتصادى، عاملى براى جداشدن آن‏ها از اصل انقلاب نیست
مسیله,باعث محبت بیشتر می‌شود؛ یعنی پیوند روح شما با سیدالشهدا علیه السلام تقویت می‏شود و رشد می‏کند چه طور با یک سلام کردن انسانیت رشد می‏کند؟! این یک مسیله‏ی قطعی علمیِ ثابت شده‏، و هم درونی است
فراش,هر کس سر و زبانی  داشت و می‌توانست دو نفر را با هم جفت کند، دلال نام می‌گرفت؛ البته روایت  دیگری هم هست؛ کسانی به دلال مراجعه می‌کردند که فرزندشان نواقصی داشت یا  مثلا پسرشان می‌خواست دوباره تجدید‌فراش کند یا دخترشان آبله‌رو بود
پسندیدن,» بله‌بران و نامزدی پس  از پسندیدن خانواده‌ها نوبت به مراسم بله‌بران می‌رسید
فراش,بعضی  از دامادها که زرنگ بودند به فراش و دایه خانه دختر پول می‌دادند تا  هنگامی که نامزدشان از خانه بیرون می‌آید، آنها را خبر کند
واداشتن,ب: هدف عمده تبليغات بايد واداشتن دشمن به نتيجه گيري مطلوبي باشد كه مورد علاقه ما است
هییت,ملایر ونایب رییس کمیسیون قضایی هستند وباید هییت نظارت بر
خمار,(یعنی بدون اجازه وارد خانه پیامبر شدن)   زینت در قرآن و سنت همان طور که در آیه خمار (آیه 31 سوره نور) آمده زنان مؤمنه از آشکار کردن زیور و زینت های پنهان خود در برابر نامحرم منع شده اند (ولا یبدین زینتهن الا ما ظهر منها) سئوال این است که مفهوم واقعی زینت از نظر قرآن و روایات چیست؟ در این اجمال نگاهی کوتاه بر این مهم موجب پاسخگویی به سؤالات و ابهامات عدیده ای در این زمینه خواهد شد
خضاب,(4)   و نیز از امام باقر علیه السلام نقل شده است که فرمودند: زینت ظاهر عبارت است از جامه، سرمه، انگشتر، خضاب و دست ها، النگو
خضاب,(5)   علامه مرتضی مطهری در کتاب گران سنگ خود مسئله حجاب از روایات فوق چنین نتیجه می گیرد که: این روایات می فهماند که برای زن پوشانیدن چهره و دست ها تا مچ واجب نیست حتی آشکار بودن آرایش های عادی و معمولی که در این قسمت ها وجود دارد نظیر سرمه و خضاب که معمولا زن از آنها خالی نیست و پاک کردن آن ها یک عمل فوق العاده (دشوار) به شمار می رود، نیز مانعی ندارد
دریده,نظام ما، نظام رئوفی است، آنقدر رئوف و مهربان که با آفتاب‌پرستانِ دستمالی شده‌ای از جنس نوری‌زاد، با مدارا رفتار می‌کند و بجای زندان اوین، هتل اوین می‌برد مخالفینش را، نمونه‌اش آزادیِ امثال اوست و آزادی قلم‌ها و زبان‌های دریده‌شان
هییت,امراللهی و سید عباس حسینی سومین مدیرعامل و رییس هییت
واداشتن,کرانه باختری قهرمان ما همچنان ریشه های انقلابی را در خود دارد که  شراره های آن تغذیه کننده نسلی است که تلاش ها برای ارعاب و تهدید و به  تسلیم واداشتن آن نتوانسته است ذات و  فطرت آنها را تغییر دهد و این نسل  مقدس با عملیات ایتمار و عملیات شهید مهند حلبی و شهید هدیل هشلمون انتفاضه  قدس را رقم زد و با خون و تحرکات و پویایی جوانی شان سعی در تجدید بیداری  را دارند
واداشتن,ما کاملا به صراحت اعلام می کنیم که کرانه باختری همچنان محور  منازعه و نماد انتفاضه و مقاومت در اشکال مختلف باقی خواهد ماند و هیچ کس  نمی تواند جلوی آنرا بگیرد و جنبش حماس برای مقابله با تمامی سیاست های  سرکوب و تلاش ها برای به حاشیه راندن این منطقه از طریق دو محور اصلی تلاش  خواهد کرد: نخست؛ حمایت از پایداری اهالی کرانه باختری و ملت فلسطین در  برابر طرح های دشمن و تلاش های آن برای به تسلیم واداشتن این ملت و دوم؛  مقاومتی که تاوان سنگینی از دشمن به خاطر اشغالگری اش بگیرد
اوردن,این گوشیو واسم اوردن وقتی که میخوای روشنش کنی 7 تا ویبر میزنه و روی ارم htc  میمونه
گند,سرتا پای این باشگاه منفور و بیت المال خور گند کاری و آبروریزی و مافیا هست
جگری,دیدار دوستانه پرسپولیس با پرسپولیس قائمشهر(7-0)/ گزارش تصویری وای چی شد لنگ در لنگ چه شود شاید جگری یاارغوانی یا لجنی
گند,بلکه ساده‌لوحان  جوزده‌ای که از انعقاد برجام به مثابه «خری که به آن تی‌تاپ داده باشند»،  از شادی و شعف در پوست خود نمی‌گنجیدند بیش از هرکس دیگری مستحق آن توهین و  تخریبی هستند که به ناحق نثار منتقدان برجام می‌کردند!   منتقدانی که هر روز بیش از دیروز معلوم می‌شود بحق دل‌نگران معامله  تقریبا تمام برنامه هسته‌ای کشور با مشتی تعهدات مبهم و مشروط بوده‌اند که  هر روز گند یک قسمتی از آن درمی‌آید و ملت همیشه در صحنه- که همین چند روز  پیش از ترس لولو سر خرمنی که جناب رئیس محترم یک قسمت مهم از مملکت  برای‌شان ساخت، به خود آن مقام محترم مجددا رای دادند- متوجه می‌شوند که  لولوی واقعی همینجاست و زیر ردای قهرمانان دیپلماسی پنهان شده است
ایین,مدیاتک قیمت تراشه هلیو P23 را برای رقابت با اسنپدراگون 450 کاهش می‌دهد   آی تی رسان   ۳ روز پیش ایین‌رده و میان‌رده مورد استفاده قرار می‌گیرد، به قیمتی معادل 10
خضاب,"در اینجا به برخی از این اشعار اشاره می کنیم: محمد حسین رحیمیان دیگر برایم دلخوشی معنا ندارد وقتی تو را بابای من دنیا ندارد رفتی یتیم بی قرار شهر کوفه حس کرد تازه طفلکی بابا ندارد رفتی برای زینب تو خستگی ماند دیگر پرستارت به پیکر نا ندارد خونت نوشته گوشه محراب مسجد این کوه طور عاشقی موسی ندارد دنیا پدر جان تا خود روز قیامت مانند تو گریه کن زهرا ندارد رفتی و از این شهر بردی مهربانی کوفه برای ماندن ما جا ندارد رفتی خیال دشمن تو گشت راحت در سر به غیر از فکر عاشورا ندارد فکری به حال روزگار دخترت کند در روزهایی که حرم سقا ندارد سید حمید رضا برقعی زخمی ام التیام می خواهم التیام از امام می خواهم السلام وعلیک یا ساقی من علیک السلام می خواهم مستی ام را بیا دوچندان کن جام می پشت جام می خواهم گاه گاهی کمی جنون دارم من جنونی مدام می خواهم تا بگردم کمی به دور سرت طوف بیت الحرام می خواهم لحظه مرگ چشم در راهم از تو حسن ختام می خواهم در نجف سینه بی قرار از عشق گفت لایمکن الفرار از عشق وقت پرواز آسمان شده بود گوئیا آخر جهان شده بود کعبه می رفت در دل محراب لحظه ی گریه ی اذان شده بود کوفه لبریز از مصیبت بود باد در کوچه نوحه خوان شده بود شور افتاد در دل زینب (س) پی بابا دلش روان شده بود در و دیوار التماسش کرد در و دیوار مهربان شده بود شوق دیدار حضرت زهرا در نگاه علی عیان شده بود خار در چشم و تیغ بین گلو زخم ،مهمان استخوان شده بود سایه ای شوم پشت هر دیوار در کمین علی نهان شده بود ناگهان آسمان ترک برداشت فرق خورشید خون فشان شده بود در نجف سینه بیقرار از عشق گفت ""لا یمکن الفرار"" از عشق رضا رسول زاده دیشب که میهمان به سرایم قدم گذاشت از سفره غیر نان و نمک هیچ بر نداشت از خانه ام که رفت دلم تاب و تب گرفت می رفت و همچو این دل من ماه شب گرفت گفتم بیا تو این سحری را بمان مرو سوزانده است قلب مرا این اذان مرو جانسوز تو نگاه بر این آسمان مکن خاک عزا بیا و سر خاندان مکن می رفت و گفت موعد دیدار آمده وقت زیارت رخ دلدار آمده می رفت و گفت گشته دلش تنگ فاطمه می برد با خودش دل پر خون ما همه خالی ست جای فاطمه تا دیده تر کند یا ناله ای کشد همه را خون جگر کند خالی ست جای فاطمه یار پدر شود در کوچه های کوفه برایش سپر شود آتش دگر به شهپر روح الامین نشست فرق علی شکافت و روی زمین نشست محراب مسجد است چنین پر شکوفه است امشب سیاه پوش علی شهر کوفه است ای خاک بر سرم سر بابا شکسته است انگار باز پهلوی زهرا شکسته است انگار تازه گشته مرا داغ مادرم افتاده یاد کوچه دوباره برادرم انگار تازه روضه ی شهر مدینه شد روی پدر خضاب از آن خون سینه شد حسن لطفی: آن که امشب در تب وصل خداست سفره دار مردمان بی نواست آن که گوید راز دل را با زمین نیست مردی جز امیر المومنین پُر شده گوشِ تمامی فلک از صدای لطمه ی خیلِ مَلک مرد می آید به سوی سجده گاه ماه می گوید که بر بندید راه در میان کوچه، بالِ جبرئیل بسته راه رفتنِ پیرِ دلیر کی خدای بیت! راه بیت گیر دست ما بر دامن پاکت امیر عالمی را غرقه در ماتم نکن سایه ات را از سرِ ما کم نکن یا به تنهایی مرو مولای من یا کسی بفرست دنبال حسن دستِ هستی شد گره بر دامنش بادها بستند راهِ رفتنش نوح آمد با تمام انبیا مرتضی در ازدحام انبیا هر یک از خیل رسل تا می رسید آستینش یا عبایش می کشید کی خدای بیت! راه بیت گیر دست ما بر دامنِ پاکت امیر ماه، پیش پاش صد چاک افتاد عشق، پاره پاره بر خاک افتاد می روی از عشق هم دل می بری باید از نعش من اول بگذری کاش از مشرق نیاید آفتاب تا نبیند کس، غروب بوتراب تا عبایِ خویش را بالا گرفت دامنش از دامنِ دریا گرفت در میان کوچه، کوچه باز شد نوحه خوانیِ فلک آغاز شد خوش خرامان، خوش قدم، خاموش رفت هر کسی در پیش پاش، از هوش رفت آن که راه خویش را وا می کند زیر لب آرام نجوا می کند کی دلِ غمدیده ام، آرام گیر ساعتی دیگر زبان در کام گیر تا که چشم خویش را بر هم زنی تا لقاء الله همراه منی صبر جایز نیست، وقت رفتن است خسته ام دیگر، زمان خفتن است زندگی بی یار طولانی شده آسمان سینه، طوفانی شده دود بود و دود بود و دود بود گل میانِ آتش نمرود بود سعید بیابانکی ای سجود باشکوه و ای نماز بی‌نظیر ای رکوع سربلند و ای قیام سر به زیر در هجوم بغض‌ها ای صبور استوار در میان تیرها ای شکست‌ناپذیر شرع را تو رهنما عقل را تو رهگشا عشق را تو سر پناه مرگ را تو دستگیر فرش آستانه‌ات بوریایی از کرم تخت پادشاهی‌ات دستبافی از حصیر کاش قدر سال بود آن شب سیاه و تلخ آسمان تو غافلی زان طلوع ناگزیر بعد از او نه من نه عشق از تو خواهم ای فلک یا ببندی‌ام به سنگ یا بدوزی‌ام به تیر دست بی‌وضو مزن بر ستیغ آفتاب آی تیغ بی‌حیا شرم کن وضو بگیر لَختی ای پدر درنگ پشت در نشسته‌اند رشته‌های سرد اشک، کاسه‌های گرم شیر سید محمد جواد شرافت: تیغی فرود آمد و فرقت شکست آه فرقت شکست و موی تو در خون نشست آه خون قطره قطره از تب پیشانی ات گذشت چشم تو را در آن سحر تیره بست آه دوران ناب ساغر عمرت به سر رسید دیگر خمار مرگ شد آن چشم مست آه زخم سرت عمیق شد اما تو را نکشت آری تو را که طاقت این درد هست، آه از آن دمی که ماه تو در خاک و خون نشست در بین کوچه آینه ی تو شکست آه زخم دل تو سر زد و جان تو را گرفت زخمی که بر نداشت دمی از تو دست آه حالا دوباره همدم زهرای خود شدی دیگر بس است ناله و دیگر بس است آه محمد سهرابی: دل که عاشق شود شرر دارد آتش از حال ما خبر دارد عاشقی قصه ای است دیرینه که دو صد لیکن و اگر دارد هر که مست است مثل انگور است چون که او هم لباس تر دارد ما که رندیم و باده نوش چه غم گر کسی جا نماز بردارد آن که حال مرا نمی داند چه نصیب از دل و جگر دارد نکشم پا ز آستانه دوست سائلش ز آن که تاج سر دارد لب من در ترّنم یادش ذکر او هر شب و سحر دارد عَجَز الواصفون عَن صفتک ای رسول زمین امام زمان یا علی ای حدوث را ممکن یا علی ای وقوع را امکان با تو هر لحظه می شود صادر بر خلایق ز مهدی ات فرمان لب لعل تو چشمه احیا چشم پاک تو چشمه حیوان موی تو لیلة المبیت من است کاش جای دلم شوم قربان تویی آن شیر کز دم تیغت دشمن و دوست می شود نهان دشمن از ترس می رود به خفا دوست بهر نظر شود پنهان جای باران سر از هوا ریزد ذو الفقارت اگر دهد جولان شیعیان را به جای خون باشد حبّ زوج بتول در شریان ما همه در صفیم بذلی کن که قبول خدا شود قربان ماه میلاد توست ماه رجب گاه میعاد توست در رمضان پای بوس تو ماه ذی القعده دست بوست محرّم و شعبان می سزد گر محبّ تو ز شعف دف به کف در نجف کند طغیان هم? انبیا به وسع وجود چیده اند از درخت تو ایمان مصطفی نیز در میان همه شرح داماد کرده در قرآن ای که در یک شب از کرامت خویش در چهل خانه بوده ای مهمان جای دارد که از نزول شما هر پدر صد پسر کند قربان سخت گیری مکن به سائل خویش رد مکن این شکسته را آسان هست روز جزا و وقت حساب حبّ تو در صحیفه ام عنوان بی تو جنت جهیم پر آتش با تو دوزخ بهشت بی پایان ای که از کعبه گشته ای ظاهر شد در این کار نکته ای پنهان ضلع تسبیح را شکستی تو ز آن که تسبیح بر تو شد تبیان بطن سبحان ربّی الاعلی می کشم نعره از جگر شب و روز تا نصیم شود ز حق غفران عجز الواصفون عن صفتک یا علی ای امیر هر میقات یا علی ای ظهیر فُلک نجات این محال است که شوی موصوف ز آن که تو برتری ز حدّ صفات در مثل رشحه غمت دجله در بزرگی ترنّم تو فرات دوستانت کلیددار بهشت عاشقان تو رشته دار حیات جای دارد که منکران تو را جا ببخشند در جهان ممات ای کریم مدینه و مکّه ای جوان مرد کوفه در خیرات یک ابوذر کفایت است که ما بر کرامات تو کنیم اثبات ای که دادی به دست سلمانت جلوه طور را به پیر برات مالک اشتر تو را باید خواند مجموعه همه ملکات همه مردم تو را به حکم بنون جمله زن ها تو را به حکم بنات هر یکی از نوادگان تو را می توان خواند حاکم عرصات همسر توست شیشه ای نازک خاندان تو در مثل مشکات تویی آن روزه دار تابستان در زمستان تویی امیر صلات در تصرف به ما ز ما اولی صاحب مال ما ز خمس و زکات بر تو از ما ز خالق تو درود بر تو از ما ز فاطمه صلوات گر درختان قلم شوند همه آب ها گر همه شوند دوات می سزد گر نویسم این جمله تا قیامت به قامت صفحات عجز الواصفون عن صفتک یا علی ای سرادق توحید ای امیر فرشته در تجرید یکی از طائفان تو افلاک یکی از حائران تو خورشید ما که مُردیم از جدایی تو پس مکن این فراق را تمدید یا علی ای قدیم تر ز قدیم یا علی ای جدید تر ز جدید تویی آن آفتاب لم یزلی که به خود از وجود خود تابید غیر تو هیج کس وجود نداشت چشم تو وا شد و علی را دید نخل ها را به آب دیده بند تا که از غصه رو کنند به عید خانه جان من ز بت پر شد ای تبردار فتح کعبه رسید با تو هر کس که در جدل افتاد گردن خود نهاد زیر حدید از پدر می رسد پسر را فیض از تو دارد حسین نام شهید می رسد از محیط بر گوشم که همه گفته اند بی تردید عجز الواصفون عن صفتک جگر اهل درد خرّم باد دل اهل مراد بی غم باد ماه فضل است و عارفان جمع اند تا ابد جمعتان منظم باد فخر حوّا از کعبه بیرون شد باز روشن دو چشم آدم باد پدر کعبه کعبه را بشکافت پر بکا دیدگان زمزم باد هر کجا طفل شیر خواری هست آب خوردن بر او مقدم باد کربلا خشک شد بهر حسین چشم اهلش همیشه پر نم باد قهر کرده فرات از اصغر دست عباس سوی پرچم باد روی دست پدر پسر جان داد همه ماه ها محرّم باد عجز الواصفون عن صفتک"
